,Unnamed: 0,Date,Stock Difference,Value,Date
0,0,21/12/2017,ChinaRail_Dif,-0.686990113,2017-12-21
1,1,21/12/2017,HongKongPT_Dif,1.167661503,2017-12-21
2,2,21/12/2017,JapanRail_Dif,0.892295961,2017-12-21
3,3,21/12/2017,SaudiPT_Dif,0.762277621,2017-12-21
4,4,21/12/2017,TramsRail_FR_Dif,0.411520263,2017-12-21
5,5,21/12/2017,FirstBus_UK_Dif,-0.067726093,2017-12-21
6,6,21/12/2017,Uestra_DE_Dif,-1.737746295,2017-12-21
7,7,21/12/2017,FirstGroup_USA_Dif,1.684675082,2017-12-21
8,8,27/12/2017,ChinaRail_Dif,-0.677342696,2017-12-27
9,9,27/12/2017,HongKongPT_Dif,1.045034478,2017-12-27
10,10,27/12/2017,JapanRail_Dif,0.878216466,2017-12-27
11,11,27/12/2017,SaudiPT_Dif,0.799721198,2017-12-27
12,12,27/12/2017,TramsRail_FR_Dif,0.43613305,2017-12-27
13,13,27/12/2017,FirstBus_UK_Dif,-0.318637929,2017-12-27
14,14,27/12/2017,Uestra_DE_Dif,-1.711176102,2017-12-27
15,15,27/12/2017,FirstGroup_USA_Dif,1.720700952,2017-12-27
16,16,28/12/2017,ChinaRail_Dif,-0.761436177,2017-12-28
17,17,28/12/2017,HongKongPT_Dif,0.912444261,2017-12-28
18,18,28/12/2017,JapanRail_Dif,0.911609138,2017-12-28
19,19,28/12/2017,SaudiPT_Dif,0.75163463,2017-12-28
20,20,28/12/2017,TramsRail_FR_Dif,0.47840337,2017-12-28
21,21,28/12/2017,FirstBus_UK_Dif,-0.334956048,2017-12-28
22,22,28/12/2017,Uestra_DE_Dif,-1.650919891,2017-12-28
23,23,28/12/2017,FirstGroup_USA_Dif,1.713366472,2017-12-28
24,24,04/01/2018,ChinaRail_Dif,-0.86713991,2018-04-01
25,25,04/01/2018,HongKongPT_Dif,0.956141451,2018-04-01
26,26,04/01/2018,JapanRail_Dif,0.834603918,2018-04-01
27,27,04/01/2018,SaudiPT_Dif,0.791362239,2018-04-01
28,28,04/01/2018,TramsRail_FR_Dif,0.46116562,2018-04-01
29,29,04/01/2018,FirstBus_UK_Dif,-0.593438553,2018-04-01
30,30,04/01/2018,Uestra_DE_Dif,-1.625275008,2018-04-01
31,31,04/01/2018,FirstGroup_USA_Dif,1.725266434,2018-04-01
32,32,09/01/2018,ChinaRail_Dif,-0.925805543,2018-09-01
33,33,09/01/2018,HongKongPT_Dif,0.705446061,2018-09-01
34,34,09/01/2018,JapanRail_Dif,0.806305223,2018-09-01
35,35,09/01/2018,SaudiPT_Dif,0.715274239,2018-09-01
36,36,09/01/2018,TramsRail_FR_Dif,0.302759259,2018-09-01
37,37,09/01/2018,FirstBus_UK_Dif,-0.363655958,2018-09-01
38,38,09/01/2018,Uestra_DE_Dif,-1.902086562,2018-09-01
39,39,09/01/2018,FirstGroup_USA_Dif,1.783925751,2018-09-01
40,40,10/01/2018,ChinaRail_Dif,-0.980552685,2018-10-01
41,41,10/01/2018,HongKongPT_Dif,0.745736151,2018-10-01
42,42,10/01/2018,JapanRail_Dif,0.920340453,2018-10-01
43,43,10/01/2018,SaudiPT_Dif,0.700732356,2018-10-01
44,44,10/01/2018,TramsRail_FR_Dif,0.330431544,2018-10-01
45,45,10/01/2018,FirstBus_UK_Dif,-0.218157875,2018-10-01
46,46,10/01/2018,Uestra_DE_Dif,-1.832351075,2018-10-01
47,47,10/01/2018,FirstGroup_USA_Dif,1.829886595,2018-10-01
48,48,11/01/2018,ChinaRail_Dif,-0.891279157,2018-11-01
49,49,11/01/2018,HongKongPT_Dif,0.848226928,2018-11-01
50,50,11/01/2018,JapanRail_Dif,0.887762807,2018-11-01
51,51,11/01/2018,SaudiPT_Dif,0.787000269,2018-11-01
52,52,11/01/2018,TramsRail_FR_Dif,0.353607538,2018-11-01
53,53,11/01/2018,FirstBus_UK_Dif,-0.125452461,2018-11-01
54,54,11/01/2018,Uestra_DE_Dif,-1.779880922,2018-11-01
55,55,11/01/2018,FirstGroup_USA_Dif,1.780370363,2018-11-01
56,56,16/01/2018,ChinaRail_Dif,-1.214149343,2018-01-16
57,57,16/01/2018,HongKongPT_Dif,0.627748866,2018-01-16
58,58,16/01/2018,JapanRail_Dif,0.750838102,2018-01-16
59,59,16/01/2018,SaudiPT_Dif,0.571850172,2018-01-16
60,60,16/01/2018,TramsRail_FR_Dif,0.317299766,2018-01-16
61,61,16/01/2018,FirstBus_UK_Dif,-0.200252164,2018-01-16
62,62,16/01/2018,Uestra_DE_Dif,-1.627289302,2018-01-16
63,63,16/01/2018,FirstGroup_USA_Dif,1.763022622,2018-01-16
64,64,17/01/2018,ChinaRail_Dif,-1.189718597,2018-01-17
65,65,17/01/2018,HongKongPT_Dif,0.605638034,2018-01-17
66,66,17/01/2018,JapanRail_Dif,0.791102577,2018-01-17
67,67,17/01/2018,SaudiPT_Dif,0.577265694,2018-01-17
68,68,17/01/2018,TramsRail_FR_Dif,0.271230492,2018-01-17
69,69,17/01/2018,FirstBus_UK_Dif,-0.043165565,2018-01-17
70,70,17/01/2018,Uestra_DE_Dif,-1.615842146,2018-01-17
71,71,17/01/2018,FirstGroup_USA_Dif,1.653675096,2018-01-17
72,72,18/01/2018,ChinaRail_Dif,-1.042491378,2018-01-18
73,73,18/01/2018,HongKongPT_Dif,0.566698394,2018-01-18
74,74,18/01/2018,JapanRail_Dif,0.729113322,2018-01-18
75,75,18/01/2018,SaudiPT_Dif,0.562810588,2018-01-18
76,76,18/01/2018,TramsRail_FR_Dif,0.270023811,2018-01-18
77,77,18/01/2018,FirstBus_UK_Dif,-0.065918487,2018-01-18
78,78,18/01/2018,Uestra_DE_Dif,-1.691133487,2018-01-18
79,79,18/01/2018,FirstGroup_USA_Dif,1.594190137,2018-01-18
80,80,22/01/2018,ChinaRail_Dif,-1.10018309,2018-01-22
81,81,22/01/2018,HongKongPT_Dif,0.490389834,2018-01-22
82,82,22/01/2018,JapanRail_Dif,0.766276177,2018-01-22
83,83,22/01/2018,SaudiPT_Dif,0.526060049,2018-01-22
84,84,22/01/2018,TramsRail_FR_Dif,0.202264457,2018-01-22
85,85,22/01/2018,FirstBus_UK_Dif,0.004816651,2018-01-22
86,86,22/01/2018,Uestra_DE_Dif,-1.813052352,2018-01-22
87,87,22/01/2018,FirstGroup_USA_Dif,1.537962631,2018-01-22
88,88,23/01/2018,ChinaRail_Dif,-1.28844453,2018-01-23
89,89,23/01/2018,HongKongPT_Dif,0.281557335,2018-01-23
90,90,23/01/2018,JapanRail_Dif,0.761797896,2018-01-23
91,91,23/01/2018,SaudiPT_Dif,0.522624761,2018-01-23
92,92,23/01/2018,TramsRail_FR_Dif,0.271583187,2018-01-23
93,93,23/01/2018,FirstBus_UK_Dif,-0.033156312,2018-01-23
94,94,23/01/2018,Uestra_DE_Dif,-1.937756067,2018-01-23
95,95,23/01/2018,FirstGroup_USA_Dif,1.474961172,2018-01-23
96,96,24/01/2018,ChinaRail_Dif,-1.277696636,2018-01-24
97,97,24/01/2018,HongKongPT_Dif,0.158078604,2018-01-24
98,98,24/01/2018,JapanRail_Dif,0.894829599,2018-01-24
99,99,24/01/2018,SaudiPT_Dif,0.431067814,2018-01-24
100,100,24/01/2018,TramsRail_FR_Dif,0.329198001,2018-01-24
101,101,24/01/2018,FirstBus_UK_Dif,0.090550189,2018-01-24
102,102,24/01/2018,Uestra_DE_Dif,-1.85094716,2018-01-24
103,103,24/01/2018,FirstGroup_USA_Dif,1.444212007,2018-01-24
104,104,25/01/2018,ChinaRail_Dif,-1.210792542,2018-01-25
105,105,25/01/2018,HongKongPT_Dif,0.417013537,2018-01-25
106,106,25/01/2018,JapanRail_Dif,0.993712584,2018-01-25
107,107,25/01/2018,SaudiPT_Dif,0.449362642,2018-01-25
108,108,25/01/2018,TramsRail_FR_Dif,0.349241536,2018-01-25
109,109,25/01/2018,FirstBus_UK_Dif,0.07089503,2018-01-25
110,110,25/01/2018,Uestra_DE_Dif,-1.783189037,2018-01-25
111,111,25/01/2018,FirstGroup_USA_Dif,1.408543585,2018-01-25
112,112,29/01/2018,ChinaRail_Dif,-1.307926653,2018-01-29
113,113,29/01/2018,HongKongPT_Dif,0.329188392,2018-01-29
114,114,29/01/2018,JapanRail_Dif,0.920968181,2018-01-29
115,115,29/01/2018,SaudiPT_Dif,0.521537946,2018-01-29
116,116,29/01/2018,TramsRail_FR_Dif,0.291224027,2018-01-29
117,117,29/01/2018,FirstBus_UK_Dif,-0.170758359,2018-01-29
118,118,29/01/2018,Uestra_DE_Dif,-1.649292286,2018-01-29
119,119,29/01/2018,FirstGroup_USA_Dif,1.436934371,2018-01-29
120,120,30/01/2018,ChinaRail_Dif,-1.309236151,2018-01-30
121,121,30/01/2018,HongKongPT_Dif,0.314660561,2018-01-30
122,122,30/01/2018,JapanRail_Dif,0.978886081,2018-01-30
123,123,30/01/2018,SaudiPT_Dif,0.544246671,2018-01-30
124,124,30/01/2018,TramsRail_FR_Dif,0.359917156,2018-01-30
125,125,30/01/2018,FirstBus_UK_Dif,-0.036817645,2018-01-30
126,126,30/01/2018,Uestra_DE_Dif,-1.71586142,2018-01-30
127,127,30/01/2018,FirstGroup_USA_Dif,1.417058999,2018-01-30
128,128,31/01/2018,ChinaRail_Dif,-1.387936748,2018-01-31
129,129,31/01/2018,HongKongPT_Dif,0.293765124,2018-01-31
130,130,31/01/2018,JapanRail_Dif,0.939846184,2018-01-31
131,131,31/01/2018,SaudiPT_Dif,0.537492138,2018-01-31
132,132,31/01/2018,TramsRail_FR_Dif,0.348206736,2018-01-31
133,133,31/01/2018,FirstBus_UK_Dif,0.0451979,2018-01-31
134,134,31/01/2018,Uestra_DE_Dif,-1.720447731,2018-01-31
135,135,31/01/2018,FirstGroup_USA_Dif,1.336343904,2018-01-31
136,136,01/02/2018,ChinaRail_Dif,-1.32832792,2018-01-02
137,137,01/02/2018,HongKongPT_Dif,0.420487673,2018-01-02
138,138,01/02/2018,JapanRail_Dif,0.960934027,2018-01-02
139,139,01/02/2018,SaudiPT_Dif,0.597009296,2018-01-02
140,140,01/02/2018,TramsRail_FR_Dif,0.387546645,2018-01-02
141,141,01/02/2018,FirstBus_UK_Dif,0.206992627,2018-01-02
142,142,01/02/2018,Uestra_DE_Dif,-1.444939313,2018-01-02
143,143,01/02/2018,FirstGroup_USA_Dif,1.289392761,2018-01-02
144,144,05/02/2018,ChinaRail_Dif,-1.244695988,2018-05-02
145,145,05/02/2018,HongKongPT_Dif,0.532044877,2018-05-02
146,146,05/02/2018,JapanRail_Dif,1.095015234,2018-05-02
147,147,05/02/2018,SaudiPT_Dif,0.581959932,2018-05-02
148,148,05/02/2018,TramsRail_FR_Dif,0.629961865,2018-05-02
149,149,05/02/2018,FirstBus_UK_Dif,0.18545107,2018-05-02
150,150,05/02/2018,Uestra_DE_Dif,-1.364471064,2018-05-02
151,151,05/02/2018,FirstGroup_USA_Dif,1.4893975,2018-05-02
152,152,06/02/2018,ChinaRail_Dif,-0.929881419,2018-06-02
153,153,06/02/2018,HongKongPT_Dif,0.995792607,2018-06-02
154,154,06/02/2018,JapanRail_Dif,1.273202144,2018-06-02
155,155,06/02/2018,SaudiPT_Dif,0.542013816,2018-06-02
156,156,06/02/2018,TramsRail_FR_Dif,0.808152886,2018-06-02
157,157,06/02/2018,FirstBus_UK_Dif,0.571823964,2018-06-02
158,158,06/02/2018,Uestra_DE_Dif,-1.14706924,2018-06-02
159,159,06/02/2018,FirstGroup_USA_Dif,1.298397108,2018-06-02
160,160,07/02/2018,ChinaRail_Dif,-0.909212042,2018-07-02
161,161,07/02/2018,HongKongPT_Dif,1.072311987,2018-07-02
162,162,07/02/2018,JapanRail_Dif,1.260659372,2018-07-02
163,163,07/02/2018,SaudiPT_Dif,0.626428419,2018-07-02
164,164,07/02/2018,TramsRail_FR_Dif,0.672965314,2018-07-02
165,165,07/02/2018,FirstBus_UK_Dif,0.343399379,2018-07-02
166,166,07/02/2018,Uestra_DE_Dif,-1.158266973,2018-07-02
167,167,07/02/2018,FirstGroup_USA_Dif,1.41164026,2018-07-02
168,168,08/02/2018,ChinaRail_Dif,-0.96382858,2018-08-02
169,169,08/02/2018,HongKongPT_Dif,1.036312297,2018-08-02
170,170,08/02/2018,JapanRail_Dif,1.176143726,2018-08-02
171,171,08/02/2018,SaudiPT_Dif,0.703766568,2018-08-02
172,172,08/02/2018,TramsRail_FR_Dif,0.822707425,2018-08-02
173,173,08/02/2018,FirstBus_UK_Dif,0.330378582,2018-08-02
174,174,08/02/2018,Uestra_DE_Dif,-1.038340908,2018-08-02
175,175,08/02/2018,FirstGroup_USA_Dif,1.425084467,2018-08-02
176,176,13/02/2018,ChinaRail_Dif,-0.959422589,2018-02-13
177,177,13/02/2018,HongKongPT_Dif,1.092658925,2018-02-13
178,178,13/02/2018,JapanRail_Dif,1.208847064,2018-02-13
179,179,13/02/2018,SaudiPT_Dif,0.572440545,2018-02-13
180,180,13/02/2018,TramsRail_FR_Dif,0.88368481,2018-02-13
181,181,13/02/2018,FirstBus_UK_Dif,0.396834478,2018-02-13
182,182,13/02/2018,Uestra_DE_Dif,-1.04612651,2018-02-13
183,183,13/02/2018,FirstGroup_USA_Dif,1.280161366,2018-02-13
184,184,14/02/2018,ChinaRail_Dif,-1.140153453,2018-02-14
185,185,14/02/2018,HongKongPT_Dif,0.671398595,2018-02-14
186,186,14/02/2018,JapanRail_Dif,1.232359767,2018-02-14
187,187,14/02/2018,SaudiPT_Dif,0.576751126,2018-02-14
188,188,14/02/2018,TramsRail_FR_Dif,0.803196373,2018-02-14
189,189,14/02/2018,FirstBus_UK_Dif,0.426319715,2018-02-14
190,190,14/02/2018,Uestra_DE_Dif,-1.151646759,2018-02-14
191,191,14/02/2018,FirstGroup_USA_Dif,1.193836549,2018-02-14
192,192,15/02/2018,ChinaRail_Dif,-1.299453166,2018-02-15
193,193,15/02/2018,HongKongPT_Dif,0.502790457,2018-02-15
194,194,15/02/2018,JapanRail_Dif,1.08797656,2018-02-15
195,195,15/02/2018,SaudiPT_Dif,0.505102662,2018-02-15
196,196,15/02/2018,TramsRail_FR_Dif,0.720925276,2018-02-15
197,197,15/02/2018,FirstBus_UK_Dif,0.458683055,2018-02-15
198,198,15/02/2018,Uestra_DE_Dif,-1.156335771,2018-02-15
199,199,15/02/2018,FirstGroup_USA_Dif,1.132862891,2018-02-15
200,200,20/02/2018,ChinaRail_Dif,-1.222176743,2018-02-20
201,201,20/02/2018,HongKongPT_Dif,0.570758456,2018-02-20
202,202,20/02/2018,JapanRail_Dif,1.135452701,2018-02-20
203,203,20/02/2018,SaudiPT_Dif,0.510518666,2018-02-20
204,204,20/02/2018,TramsRail_FR_Dif,0.624171901,2018-02-20
205,205,20/02/2018,FirstBus_UK_Dif,0.379760488,2018-02-20
206,206,20/02/2018,Uestra_DE_Dif,-1.251142901,2018-02-20
207,207,20/02/2018,FirstGroup_USA_Dif,1.175834431,2018-02-20
208,208,21/02/2018,ChinaRail_Dif,-1.295324474,2018-02-21
209,209,21/02/2018,HongKongPT_Dif,0.41383545,2018-02-21
210,210,21/02/2018,JapanRail_Dif,1.08960212,2018-02-21
211,211,21/02/2018,SaudiPT_Dif,0.51398706,2018-02-21
212,212,21/02/2018,TramsRail_FR_Dif,0.606484902,2018-02-21
213,213,21/02/2018,FirstBus_UK_Dif,0.40069773,2018-02-21
214,214,21/02/2018,Uestra_DE_Dif,-1.239496802,2018-02-21
215,215,21/02/2018,FirstGroup_USA_Dif,0.715793552,2018-02-21
216,216,22/02/2018,ChinaRail_Dif,-1.201509461,2018-02-22
217,217,22/02/2018,HongKongPT_Dif,0.544884159,2018-02-22
218,218,22/02/2018,JapanRail_Dif,1.080633404,2018-02-22
219,219,22/02/2018,SaudiPT_Dif,0.516591031,2018-02-22
220,220,22/02/2018,TramsRail_FR_Dif,0.596341063,2018-02-22
221,221,22/02/2018,FirstBus_UK_Dif,0.371748316,2018-02-22
222,222,22/02/2018,Uestra_DE_Dif,-1.233757369,2018-02-22
223,223,22/02/2018,FirstGroup_USA_Dif,0.68082359,2018-02-22
224,224,26/02/2018,ChinaRail_Dif,-1.295459607,2018-02-26
225,225,26/02/2018,HongKongPT_Dif,0.510693383,2018-02-26
226,226,26/02/2018,JapanRail_Dif,1.087815271,2018-02-26
227,227,26/02/2018,SaudiPT_Dif,0.496647429,2018-02-26
228,228,26/02/2018,TramsRail_FR_Dif,0.546010535,2018-02-26
229,229,26/02/2018,FirstBus_UK_Dif,0.420135444,2018-02-26
230,230,26/02/2018,Uestra_DE_Dif,-1.277324411,2018-02-26
231,231,26/02/2018,FirstGroup_USA_Dif,0.499752716,2018-02-26
232,232,27/02/2018,ChinaRail_Dif,-1.21220835,2018-02-27
233,233,27/02/2018,HongKongPT_Dif,0.575327793,2018-02-27
234,234,27/02/2018,JapanRail_Dif,1.0188255,2018-02-27
235,235,27/02/2018,SaudiPT_Dif,0.503139377,2018-02-27
236,236,27/02/2018,TramsRail_FR_Dif,0.598675876,2018-02-27
237,237,27/02/2018,FirstBus_UK_Dif,0.337605757,2018-02-27
238,238,27/02/2018,Uestra_DE_Dif,-1.253036012,2018-02-27
239,239,27/02/2018,FirstGroup_USA_Dif,0.738702352,2018-02-27
240,240,28/02/2018,ChinaRail_Dif,-1.111658713,2018-02-28
241,241,28/02/2018,HongKongPT_Dif,0.694494277,2018-02-28
242,242,28/02/2018,JapanRail_Dif,1.040244433,2018-02-28
243,243,28/02/2018,SaudiPT_Dif,0.640842101,2018-02-28
244,244,28/02/2018,TramsRail_FR_Dif,0.632354205,2018-02-28
245,245,28/02/2018,FirstBus_UK_Dif,0.282328337,2018-02-28
246,246,28/02/2018,Uestra_DE_Dif,-1.216324804,2018-02-28
247,247,28/02/2018,FirstGroup_USA_Dif,0.59573095,2018-02-28
248,248,01/03/2018,ChinaRail_Dif,-1.177052918,2018-01-03
249,249,01/03/2018,HongKongPT_Dif,0.638407955,2018-01-03
250,250,01/03/2018,JapanRail_Dif,1.06383945,2018-01-03
251,251,01/03/2018,SaudiPT_Dif,0.615471455,2018-01-03
252,252,01/03/2018,TramsRail_FR_Dif,0.715587841,2018-01-03
253,253,01/03/2018,FirstBus_UK_Dif,0.421933947,2018-01-03
254,254,01/03/2018,Uestra_DE_Dif,-1.002042411,2018-01-03
255,255,01/03/2018,FirstGroup_USA_Dif,0.608238495,2018-01-03
256,256,05/03/2018,ChinaRail_Dif,-0.972594988,2018-05-03
257,257,05/03/2018,HongKongPT_Dif,1.195095899,2018-05-03
258,258,05/03/2018,JapanRail_Dif,1.256284823,2018-05-03
259,259,05/03/2018,SaudiPT_Dif,0.644511783,2018-05-03
260,260,05/03/2018,TramsRail_FR_Dif,0.852557372,2018-05-03
261,261,05/03/2018,FirstBus_UK_Dif,0.75930697,2018-05-03
262,262,05/03/2018,Uestra_DE_Dif,-0.864463855,2018-05-03
263,263,05/03/2018,FirstGroup_USA_Dif,0.630671111,2018-05-03
264,264,06/03/2018,ChinaRail_Dif,-1.129476346,2018-06-03
265,265,06/03/2018,HongKongPT_Dif,1.019598234,2018-06-03
266,266,06/03/2018,JapanRail_Dif,1.156407939,2018-06-03
267,267,06/03/2018,SaudiPT_Dif,0.728547534,2018-06-03
268,268,06/03/2018,TramsRail_FR_Dif,0.848246995,2018-06-03
269,269,06/03/2018,FirstBus_UK_Dif,0.809828354,2018-06-03
270,270,06/03/2018,Uestra_DE_Dif,-0.879849143,2018-06-03
271,271,06/03/2018,FirstGroup_USA_Dif,0.800052381,2018-06-03
272,272,07/03/2018,ChinaRail_Dif,-1.0784995,2018-07-03
273,273,07/03/2018,HongKongPT_Dif,1.107808235,2018-07-03
274,274,07/03/2018,JapanRail_Dif,1.207917544,2018-07-03
275,275,07/03/2018,SaudiPT_Dif,0.682006749,2018-07-03
276,276,07/03/2018,TramsRail_FR_Dif,0.822959309,2018-07-03
277,277,07/03/2018,FirstBus_UK_Dif,0.843312089,2018-07-03
278,278,07/03/2018,Uestra_DE_Dif,-0.967806318,2018-07-03
279,279,07/03/2018,FirstGroup_USA_Dif,0.721292166,2018-07-03
280,280,08/03/2018,ChinaRail_Dif,-1.225744473,2018-08-03
281,281,08/03/2018,HongKongPT_Dif,0.97918011,2018-08-03
282,282,08/03/2018,JapanRail_Dif,1.152965031,2018-08-03
283,283,08/03/2018,SaudiPT_Dif,0.635145968,2018-08-03
284,284,08/03/2018,TramsRail_FR_Dif,0.727743049,2018-08-03
285,285,08/03/2018,FirstBus_UK_Dif,0.684773499,2018-08-03
286,286,08/03/2018,Uestra_DE_Dif,-1.041528576,2018-08-03
287,287,08/03/2018,FirstGroup_USA_Dif,0.70314959,2018-08-03
288,288,12/03/2018,ChinaRail_Dif,-1.368910367,2018-12-03
289,289,12/03/2018,HongKongPT_Dif,0.425979043,2018-12-03
290,290,12/03/2018,JapanRail_Dif,1.091196734,2018-12-03
291,291,12/03/2018,SaudiPT_Dif,0.536259522,2018-12-03
292,292,12/03/2018,TramsRail_FR_Dif,0.695257369,2018-12-03
293,293,12/03/2018,FirstBus_UK_Dif,0.803109915,2018-12-03
294,294,12/03/2018,Uestra_DE_Dif,-1.083550034,2018-12-03
295,295,12/03/2018,FirstGroup_USA_Dif,0.565032619,2018-12-03
296,296,13/03/2018,ChinaRail_Dif,-1.380219933,2018-03-13
297,297,13/03/2018,HongKongPT_Dif,0.423977901,2018-03-13
298,298,13/03/2018,JapanRail_Dif,1.080974507,2018-03-13
299,299,13/03/2018,SaudiPT_Dif,0.512486161,2018-03-13
300,300,13/03/2018,TramsRail_FR_Dif,0.743993255,2018-03-13
301,301,13/03/2018,FirstBus_UK_Dif,0.913210462,2018-03-13
302,302,13/03/2018,Uestra_DE_Dif,-0.911166272,2018-03-13
303,303,13/03/2018,FirstGroup_USA_Dif,0.636973473,2018-03-13
304,304,14/03/2018,ChinaRail_Dif,-1.361360212,2018-03-14
305,305,14/03/2018,HongKongPT_Dif,0.528568054,2018-03-14
306,306,14/03/2018,JapanRail_Dif,1.074199397,2018-03-14
307,307,14/03/2018,SaudiPT_Dif,0.64072083,2018-03-14
308,308,14/03/2018,TramsRail_FR_Dif,0.75754246,2018-03-14
309,309,14/03/2018,FirstBus_UK_Dif,0.833722623,2018-03-14
310,310,14/03/2018,Uestra_DE_Dif,-0.962709027,2018-03-14
311,311,14/03/2018,FirstGroup_USA_Dif,0.606753428,2018-03-14
312,312,15/03/2018,ChinaRail_Dif,-1.428414497,2018-03-15
313,313,15/03/2018,HongKongPT_Dif,0.440941764,2018-03-15
314,314,15/03/2018,JapanRail_Dif,1.015346607,2018-03-15
315,315,15/03/2018,SaudiPT_Dif,0.699917241,2018-03-15
316,316,15/03/2018,TramsRail_FR_Dif,0.708835338,2018-03-15
317,317,15/03/2018,FirstBus_UK_Dif,0.867124849,2018-03-15
318,318,15/03/2018,Uestra_DE_Dif,-1.034832135,2018-03-15
319,319,15/03/2018,FirstGroup_USA_Dif,0.529230948,2018-03-15
320,320,19/03/2018,ChinaRail_Dif,-1.495195764,2018-03-19
321,321,19/03/2018,HongKongPT_Dif,0.448626807,2018-03-19
322,322,19/03/2018,JapanRail_Dif,1.103537332,2018-03-19
323,323,19/03/2018,SaudiPT_Dif,0.701835429,2018-03-19
324,324,19/03/2018,TramsRail_FR_Dif,0.772657544,2018-03-19
325,325,19/03/2018,FirstBus_UK_Dif,1.060498742,2018-03-19
326,326,19/03/2018,Uestra_DE_Dif,-0.767205448,2018-03-19
327,327,19/03/2018,FirstGroup_USA_Dif,0.553619259,2018-03-19
328,328,20/03/2018,ChinaRail_Dif,-1.523980271,2018-03-20
329,329,20/03/2018,HongKongPT_Dif,0.611877059,2018-03-20
330,330,20/03/2018,JapanRail_Dif,1.175785516,2018-03-20
331,331,20/03/2018,SaudiPT_Dif,0.691090411,2018-03-20
332,332,20/03/2018,TramsRail_FR_Dif,0.73014238,2018-03-20
333,333,20/03/2018,FirstBus_UK_Dif,0.972073743,2018-03-20
334,334,20/03/2018,Uestra_DE_Dif,-0.999168223,2018-03-20
335,335,20/03/2018,FirstGroup_USA_Dif,0.468968044,2018-03-20
336,336,22/03/2018,ChinaRail_Dif,-1.40798753,2018-03-22
337,337,22/03/2018,HongKongPT_Dif,0.746486648,2018-03-22
338,338,22/03/2018,JapanRail_Dif,1.109925152,2018-03-22
339,339,22/03/2018,SaudiPT_Dif,0.666675557,2018-03-22
340,340,22/03/2018,TramsRail_FR_Dif,0.710921867,2018-03-22
341,341,22/03/2018,FirstBus_UK_Dif,0.907466538,2018-03-22
342,342,22/03/2018,Uestra_DE_Dif,-0.719255594,2018-03-22
343,343,22/03/2018,FirstGroup_USA_Dif,0.565747313,2018-03-22
344,344,26/03/2018,ChinaRail_Dif,-1.354260997,2018-03-26
345,345,26/03/2018,HongKongPT_Dif,1.008905713,2018-03-26
346,346,26/03/2018,JapanRail_Dif,1.276096684,2018-03-26
347,347,26/03/2018,SaudiPT_Dif,0.580401084,2018-03-26
348,348,26/03/2018,TramsRail_FR_Dif,0.855937576,2018-03-26
349,349,26/03/2018,FirstBus_UK_Dif,1.029343439,2018-03-26
350,350,26/03/2018,Uestra_DE_Dif,-0.661371138,2018-03-26
351,351,26/03/2018,FirstGroup_USA_Dif,0.473216058,2018-03-26
352,352,27/03/2018,ChinaRail_Dif,-1.375760984,2018-03-27
353,353,27/03/2018,HongKongPT_Dif,0.709642564,2018-03-27
354,354,27/03/2018,JapanRail_Dif,1.336198458,2018-03-27
355,355,27/03/2018,SaudiPT_Dif,0.435571211,2018-03-27
356,356,27/03/2018,TramsRail_FR_Dif,0.784873178,2018-03-27
357,357,27/03/2018,FirstBus_UK_Dif,0.634466085,2018-03-27
358,358,27/03/2018,Uestra_DE_Dif,-0.784166008,2018-03-27
359,359,27/03/2018,FirstGroup_USA_Dif,0.581015923,2018-03-27
360,360,28/03/2018,ChinaRail_Dif,-1.113255304,2018-03-28
361,361,28/03/2018,HongKongPT_Dif,0.925606665,2018-03-28
362,362,28/03/2018,JapanRail_Dif,1.488852282,2018-03-28
363,363,28/03/2018,SaudiPT_Dif,0.488815197,2018-03-28
364,364,28/03/2018,TramsRail_FR_Dif,0.763752751,2018-03-28
365,365,28/03/2018,FirstBus_UK_Dif,0.651827125,2018-03-28
366,366,28/03/2018,Uestra_DE_Dif,-0.764017892,2018-03-28
367,367,28/03/2018,FirstGroup_USA_Dif,0.697943118,2018-03-28
368,368,29/03/2018,ChinaRail_Dif,-1.133171194,2018-03-29
369,369,29/03/2018,HongKongPT_Dif,1.136912358,2018-03-29
370,370,29/03/2018,JapanRail_Dif,1.396679611,2018-03-29
371,371,29/03/2018,SaudiPT_Dif,0.404298297,2018-03-29
372,372,29/03/2018,TramsRail_FR_Dif,0.755528652,2018-03-29
373,373,29/03/2018,FirstBus_UK_Dif,0.62713384,2018-03-29
374,374,29/03/2018,Uestra_DE_Dif,-0.858292767,2018-03-29
375,375,29/03/2018,FirstGroup_USA_Dif,0.710707481,2018-03-29
376,376,03/04/2018,ChinaRail_Dif,-0.924838264,2018-03-04
377,377,03/04/2018,HongKongPT_Dif,0.996926936,2018-03-04
378,378,03/04/2018,JapanRail_Dif,1.347181335,2018-03-04
379,379,03/04/2018,SaudiPT_Dif,0.476741939,2018-03-04
380,380,03/04/2018,TramsRail_FR_Dif,0.777338711,2018-03-04
381,381,03/04/2018,FirstBus_UK_Dif,0.74468921,2018-03-04
382,382,03/04/2018,Uestra_DE_Dif,-0.653948472,2018-03-04
383,383,03/04/2018,FirstGroup_USA_Dif,0.8949904,2018-03-04
384,384,04/04/2018,ChinaRail_Dif,-0.850620394,2018-04-04
385,385,04/04/2018,HongKongPT_Dif,1.298454186,2018-04-04
386,386,04/04/2018,JapanRail_Dif,1.425830439,2018-04-04
387,387,04/04/2018,SaudiPT_Dif,0.447220307,2018-04-04
388,388,04/04/2018,TramsRail_FR_Dif,0.792166858,2018-04-04
389,389,04/04/2018,FirstBus_UK_Dif,0.782363321,2018-04-04
390,390,04/04/2018,Uestra_DE_Dif,-0.725060747,2018-04-04
391,391,04/04/2018,FirstGroup_USA_Dif,0.920288025,2018-04-04
392,392,09/04/2018,ChinaRail_Dif,-0.966672158,2018-09-04
393,393,09/04/2018,HongKongPT_Dif,0.867406105,2018-09-04
394,394,09/04/2018,JapanRail_Dif,1.529394169,2018-09-04
395,395,09/04/2018,SaudiPT_Dif,0.377913598,2018-09-04
396,396,09/04/2018,TramsRail_FR_Dif,0.617466793,2018-09-04
397,397,09/04/2018,FirstBus_UK_Dif,0.373771289,2018-09-04
398,398,09/04/2018,Uestra_DE_Dif,-0.887948349,2018-09-04
399,399,09/04/2018,FirstGroup_USA_Dif,1.118397822,2018-09-04
400,400,10/04/2018,ChinaRail_Dif,-1.097673703,2018-10-04
401,401,10/04/2018,HongKongPT_Dif,0.958317178,2018-10-04
402,402,10/04/2018,JapanRail_Dif,1.463061656,2018-10-04
403,403,10/04/2018,SaudiPT_Dif,0.394881206,2018-10-04
404,404,10/04/2018,TramsRail_FR_Dif,0.583827823,2018-10-04
405,405,10/04/2018,FirstBus_UK_Dif,0.359576887,2018-10-04
406,406,10/04/2018,Uestra_DE_Dif,-0.978634793,2018-10-04
407,407,10/04/2018,FirstGroup_USA_Dif,1.212622302,2018-10-04
408,408,11/04/2018,ChinaRail_Dif,-1.126553906,2018-11-04
409,409,11/04/2018,HongKongPT_Dif,0.968626772,2018-11-04
410,410,11/04/2018,JapanRail_Dif,1.396689451,2018-11-04
411,411,11/04/2018,SaudiPT_Dif,0.338134926,2018-11-04
412,412,11/04/2018,TramsRail_FR_Dif,0.641298354,2018-11-04
413,413,11/04/2018,FirstBus_UK_Dif,0.350684762,2018-11-04
414,414,11/04/2018,Uestra_DE_Dif,-0.899409594,2018-11-04
415,415,11/04/2018,FirstGroup_USA_Dif,1.524300057,2018-11-04
416,416,12/04/2018,ChinaRail_Dif,-1.098572002,2018-12-04
417,417,12/04/2018,HongKongPT_Dif,0.987300253,2018-12-04
418,418,12/04/2018,JapanRail_Dif,1.27828495,2018-12-04
419,419,12/04/2018,SaudiPT_Dif,0.337018364,2018-12-04
420,420,12/04/2018,TramsRail_FR_Dif,0.611266929,2018-12-04
421,421,12/04/2018,FirstBus_UK_Dif,0.451611048,2018-12-04
422,422,12/04/2018,Uestra_DE_Dif,-0.980376367,2018-12-04
423,423,12/04/2018,FirstGroup_USA_Dif,1.835412237,2018-12-04
424,424,16/04/2018,ChinaRail_Dif,-0.953615219,2018-04-16
425,425,16/04/2018,HongKongPT_Dif,1.132257035,2018-04-16
426,426,16/04/2018,JapanRail_Dif,1.271129101,2018-04-16
427,427,16/04/2018,SaudiPT_Dif,0.362754796,2018-04-16
428,428,16/04/2018,TramsRail_FR_Dif,0.60589369,2018-04-16
429,429,16/04/2018,FirstBus_UK_Dif,0.573754855,2018-04-16
430,430,16/04/2018,Uestra_DE_Dif,-0.904042495,2018-04-16
431,431,16/04/2018,FirstGroup_USA_Dif,1.872723367,2018-04-16
432,432,17/04/2018,ChinaRail_Dif,-0.863926818,2018-04-17
433,433,17/04/2018,HongKongPT_Dif,1.203328588,2018-04-17
434,434,17/04/2018,JapanRail_Dif,1.324413841,2018-04-17
435,435,17/04/2018,SaudiPT_Dif,0.288181502,2018-04-17
436,436,17/04/2018,TramsRail_FR_Dif,0.547588543,2018-04-17
437,437,17/04/2018,FirstBus_UK_Dif,0.438095513,2018-04-17
438,438,17/04/2018,Uestra_DE_Dif,-0.89264337,2018-04-17
439,439,17/04/2018,FirstGroup_USA_Dif,1.838441859,2018-04-17
440,440,18/04/2018,ChinaRail_Dif,-0.833104714,2018-04-18
441,441,18/04/2018,HongKongPT_Dif,1.141066451,2018-04-18
442,442,18/04/2018,JapanRail_Dif,1.298782545,2018-04-18
443,443,18/04/2018,SaudiPT_Dif,0.219779521,2018-04-18
444,444,18/04/2018,TramsRail_FR_Dif,0.50932693,2018-04-18
445,445,18/04/2018,FirstBus_UK_Dif,0.255374437,2018-04-18
446,446,18/04/2018,Uestra_DE_Dif,-0.785157758,2018-04-18
447,447,18/04/2018,FirstGroup_USA_Dif,1.88890638,2018-04-18
448,448,19/04/2018,ChinaRail_Dif,-0.868567821,2018-04-19
449,449,19/04/2018,HongKongPT_Dif,1.021829694,2018-04-19
450,450,19/04/2018,JapanRail_Dif,1.315429326,2018-04-19
451,451,19/04/2018,SaudiPT_Dif,0.26966828,2018-04-19
452,452,19/04/2018,TramsRail_FR_Dif,0.492846612,2018-04-19
453,453,19/04/2018,FirstBus_UK_Dif,0.325188557,2018-04-19
454,454,19/04/2018,Uestra_DE_Dif,-0.769498107,2018-04-19
455,455,19/04/2018,FirstGroup_USA_Dif,1.969986728,2018-04-19
456,456,23/04/2018,ChinaRail_Dif,-0.806097886,2018-04-23
457,457,23/04/2018,HongKongPT_Dif,1.149456973,2018-04-23
458,458,23/04/2018,JapanRail_Dif,1.26680086,2018-04-23
459,459,23/04/2018,SaudiPT_Dif,0.301685295,2018-04-23
460,460,23/04/2018,TramsRail_FR_Dif,0.425447158,2018-04-23
461,461,23/04/2018,FirstBus_UK_Dif,0.295753099,2018-04-23
462,462,23/04/2018,Uestra_DE_Dif,-0.772822484,2018-04-23
463,463,23/04/2018,FirstGroup_USA_Dif,1.966776756,2018-04-23
464,464,24/04/2018,ChinaRail_Dif,-0.811038334,2018-04-24
465,465,24/04/2018,HongKongPT_Dif,1.042124401,2018-04-24
466,466,24/04/2018,JapanRail_Dif,1.285125197,2018-04-24
467,467,24/04/2018,SaudiPT_Dif,0.323175218,2018-04-24
468,468,24/04/2018,TramsRail_FR_Dif,0.417386247,2018-04-24
469,469,24/04/2018,FirstBus_UK_Dif,0.335249002,2018-04-24
470,470,24/04/2018,Uestra_DE_Dif,-0.879489436,2018-04-24
471,471,24/04/2018,FirstGroup_USA_Dif,2.020042002,2018-04-24
472,472,25/04/2018,ChinaRail_Dif,-0.696511111,2018-04-25
473,473,25/04/2018,HongKongPT_Dif,1.128726351,2018-04-25
474,474,25/04/2018,JapanRail_Dif,1.306310301,2018-04-25
475,475,25/04/2018,SaudiPT_Dif,0.336312799,2018-04-25
476,476,25/04/2018,TramsRail_FR_Dif,0.461726166,2018-04-25
477,477,25/04/2018,FirstBus_UK_Dif,0.332382769,2018-04-25
478,478,25/04/2018,Uestra_DE_Dif,-0.823792719,2018-04-25
479,479,25/04/2018,FirstGroup_USA_Dif,1.992127402,2018-04-25
480,480,26/04/2018,ChinaRail_Dif,-0.634354258,2018-04-26
481,481,26/04/2018,HongKongPT_Dif,1.218808477,2018-04-26
482,482,26/04/2018,JapanRail_Dif,1.278514916,2018-04-26
483,483,26/04/2018,SaudiPT_Dif,0.353119949,2018-04-26
484,484,26/04/2018,TramsRail_FR_Dif,0.403851775,2018-04-26
485,485,26/04/2018,FirstBus_UK_Dif,0.13995501,2018-04-26
486,486,26/04/2018,Uestra_DE_Dif,-0.886173803,2018-04-26
487,487,26/04/2018,FirstGroup_USA_Dif,1.975911015,2018-04-26
488,488,02/05/2018,ChinaRail_Dif,-0.416798221,2018-02-05
489,489,02/05/2018,HongKongPT_Dif,0.786268582,2018-02-05
490,490,02/05/2018,JapanRail_Dif,1.501692184,2018-02-05
491,491,02/05/2018,SaudiPT_Dif,0.338285951,2018-02-05
492,492,02/05/2018,TramsRail_FR_Dif,0.295172602,2018-02-05
493,493,02/05/2018,FirstBus_UK_Dif,-0.201419459,2018-02-05
494,494,02/05/2018,Uestra_DE_Dif,-0.795395483,2018-02-05
495,495,02/05/2018,FirstGroup_USA_Dif,1.968709041,2018-02-05
496,496,08/05/2018,ChinaRail_Dif,-0.438247556,2018-08-05
497,497,08/05/2018,HongKongPT_Dif,0.876519254,2018-08-05
498,498,08/05/2018,JapanRail_Dif,1.39857234,2018-08-05
499,499,08/05/2018,SaudiPT_Dif,0.142794433,2018-08-05
500,500,08/05/2018,TramsRail_FR_Dif,0.305646875,2018-08-05
501,501,08/05/2018,FirstBus_UK_Dif,-0.129906954,2018-08-05
502,502,08/05/2018,Uestra_DE_Dif,-0.812227998,2018-08-05
503,503,08/05/2018,FirstGroup_USA_Dif,1.301963378,2018-08-05
504,504,09/05/2018,ChinaRail_Dif,-0.522267309,2018-09-05
505,505,09/05/2018,HongKongPT_Dif,0.839041079,2018-09-05
506,506,09/05/2018,JapanRail_Dif,1.386936957,2018-09-05
507,507,09/05/2018,SaudiPT_Dif,0.218334746,2018-09-05
508,508,09/05/2018,TramsRail_FR_Dif,0.287400032,2018-09-05
509,509,09/05/2018,FirstBus_UK_Dif,-0.248804649,2018-09-05
510,510,09/05/2018,Uestra_DE_Dif,-0.832864089,2018-09-05
511,511,09/05/2018,FirstGroup_USA_Dif,1.379314509,2018-09-05
512,512,10/05/2018,ChinaRail_Dif,-0.552486674,2018-10-05
513,513,10/05/2018,HongKongPT_Dif,0.704473085,2018-10-05
514,514,10/05/2018,JapanRail_Dif,1.372055228,2018-10-05
515,515,10/05/2018,SaudiPT_Dif,0.183866949,2018-10-05
516,516,10/05/2018,TramsRail_FR_Dif,0.271135094,2018-10-05
517,517,10/05/2018,FirstBus_UK_Dif,-0.330646593,2018-10-05
518,518,10/05/2018,Uestra_DE_Dif,-0.886251402,2018-10-05
519,519,10/05/2018,FirstGroup_USA_Dif,1.403726247,2018-10-05
520,520,14/05/2018,ChinaRail_Dif,-0.711665225,2018-05-14
521,521,14/05/2018,HongKongPT_Dif,0.614364623,2018-05-14
522,522,14/05/2018,JapanRail_Dif,1.377425754,2018-05-14
523,523,14/05/2018,SaudiPT_Dif,0.096338005,2018-05-14
524,524,14/05/2018,TramsRail_FR_Dif,0.278707017,2018-05-14
525,525,14/05/2018,FirstBus_UK_Dif,-0.438355017,2018-05-14
526,526,14/05/2018,Uestra_DE_Dif,-0.856042621,2018-05-14
527,527,14/05/2018,FirstGroup_USA_Dif,1.716113256,2018-05-14
528,528,15/05/2018,ChinaRail_Dif,-0.592997284,2018-05-15
529,529,15/05/2018,HongKongPT_Dif,0.72372414,2018-05-15
530,530,15/05/2018,JapanRail_Dif,1.427220657,2018-05-15
531,531,15/05/2018,SaudiPT_Dif,0.085403152,2018-05-15
532,532,15/05/2018,TramsRail_FR_Dif,0.260775876,2018-05-15
533,533,15/05/2018,FirstBus_UK_Dif,-0.423690765,2018-05-15
534,534,15/05/2018,Uestra_DE_Dif,-0.850912014,2018-05-15
535,535,15/05/2018,FirstGroup_USA_Dif,1.901277015,2018-05-15
536,536,16/05/2018,ChinaRail_Dif,-0.646397562,2018-05-16
537,537,16/05/2018,HongKongPT_Dif,0.73548229,2018-05-16
538,538,16/05/2018,JapanRail_Dif,1.450753827,2018-05-16
539,539,16/05/2018,SaudiPT_Dif,0.080851828,2018-05-16
540,540,16/05/2018,TramsRail_FR_Dif,0.24011497,2018-05-16
541,541,16/05/2018,FirstBus_UK_Dif,-0.385274732,2018-05-16
542,542,16/05/2018,Uestra_DE_Dif,-0.786893783,2018-05-16
543,543,16/05/2018,FirstGroup_USA_Dif,1.95524183,2018-05-16
544,544,17/05/2018,ChinaRail_Dif,-0.617777574,2018-05-17
545,545,17/05/2018,HongKongPT_Dif,0.782719667,2018-05-17
546,546,17/05/2018,JapanRail_Dif,1.420869431,2018-05-17
547,547,17/05/2018,SaudiPT_Dif,0.075245806,2018-05-17
548,548,17/05/2018,TramsRail_FR_Dif,0.161982368,2018-05-17
549,549,17/05/2018,FirstBus_UK_Dif,-0.218756617,2018-05-17
550,550,17/05/2018,Uestra_DE_Dif,-0.866014479,2018-05-17
551,551,17/05/2018,FirstGroup_USA_Dif,2.037373406,2018-05-17
552,552,23/05/2018,ChinaRail_Dif,-0.540052568,2018-05-23
553,553,23/05/2018,HongKongPT_Dif,0.687027304,2018-05-23
554,554,23/05/2018,JapanRail_Dif,1.551245127,2018-05-23
555,555,23/05/2018,SaudiPT_Dif,0.065478183,2018-05-23
556,556,23/05/2018,TramsRail_FR_Dif,0.317103343,2018-05-23
557,557,23/05/2018,FirstBus_UK_Dif,-0.093392482,2018-05-23
558,558,23/05/2018,Uestra_DE_Dif,-0.855460577,2018-05-23
559,559,23/05/2018,FirstGroup_USA_Dif,1.992915091,2018-05-23
560,560,24/05/2018,ChinaRail_Dif,-0.510841632,2018-05-24
561,561,24/05/2018,HongKongPT_Dif,0.602584022,2018-05-24
562,562,24/05/2018,JapanRail_Dif,1.679249593,2018-05-24
563,563,24/05/2018,SaudiPT_Dif,0.127143924,2018-05-24
564,564,24/05/2018,TramsRail_FR_Dif,0.34210339,2018-05-24
565,565,24/05/2018,FirstBus_UK_Dif,0.018347109,2018-05-24
566,566,24/05/2018,Uestra_DE_Dif,-0.774018893,2018-05-24
567,567,24/05/2018,FirstGroup_USA_Dif,1.934920904,2018-05-24
568,568,29/05/2018,ChinaRail_Dif,-0.451923447,2018-05-29
569,569,29/05/2018,HongKongPT_Dif,0.622312814,2018-05-29
570,570,29/05/2018,JapanRail_Dif,1.80360997,2018-05-29
571,571,29/05/2018,SaudiPT_Dif,0.167608001,2018-05-29
572,572,29/05/2018,TramsRail_FR_Dif,0.500711099,2018-05-29
573,573,29/05/2018,FirstBus_UK_Dif,0.093916438,2018-05-29
574,574,29/05/2018,Uestra_DE_Dif,-0.438761493,2018-05-29
575,575,29/05/2018,FirstGroup_USA_Dif,1.962441776,2018-05-29
576,576,30/05/2018,ChinaRail_Dif,-0.471300135,2018-05-30
577,577,30/05/2018,HongKongPT_Dif,0.915976479,2018-05-30
578,578,30/05/2018,JapanRail_Dif,1.885928127,2018-05-30
579,579,30/05/2018,SaudiPT_Dif,0.126257814,2018-05-30
580,580,30/05/2018,TramsRail_FR_Dif,0.51609909,2018-05-30
581,581,30/05/2018,FirstBus_UK_Dif,0.106085862,2018-05-30
582,582,30/05/2018,Uestra_DE_Dif,-0.517193012,2018-05-30
583,583,30/05/2018,FirstGroup_USA_Dif,1.774915641,2018-05-30
584,584,31/05/2018,ChinaRail_Dif,-0.410187311,2018-05-31
585,585,31/05/2018,HongKongPT_Dif,0.742425168,2018-05-31
586,586,31/05/2018,JapanRail_Dif,1.831888145,2018-05-31
587,587,31/05/2018,SaudiPT_Dif,0.095065722,2018-05-31
588,588,31/05/2018,TramsRail_FR_Dif,0.55769451,2018-05-31
589,589,31/05/2018,FirstBus_UK_Dif,0.105136304,2018-05-31
590,590,31/05/2018,Uestra_DE_Dif,-0.270035162,2018-05-31
591,591,31/05/2018,FirstGroup_USA_Dif,0.933474442,2018-05-31
592,592,04/06/2018,ChinaRail_Dif,-0.475228359,2018-04-06
593,593,04/06/2018,HongKongPT_Dif,0.53580463,2018-04-06
594,594,04/06/2018,JapanRail_Dif,1.785951036,2018-04-06
595,595,04/06/2018,SaudiPT_Dif,9.94e-05,2018-04-06
596,596,04/06/2018,TramsRail_FR_Dif,0.525198653,2018-04-06
597,597,04/06/2018,FirstBus_UK_Dif,0.118269583,2018-04-06
598,598,04/06/2018,Uestra_DE_Dif,-0.125969514,2018-04-06
599,599,04/06/2018,FirstGroup_USA_Dif,1.039123702,2018-04-06
600,600,05/06/2018,ChinaRail_Dif,-0.511371855,2018-05-06
601,601,05/06/2018,HongKongPT_Dif,0.566773231,2018-05-06
602,602,05/06/2018,JapanRail_Dif,1.823150149,2018-05-06
603,603,05/06/2018,SaudiPT_Dif,-0.032314448,2018-05-06
604,604,05/06/2018,TramsRail_FR_Dif,0.542382634,2018-05-06
605,605,05/06/2018,FirstBus_UK_Dif,0.217651144,2018-05-06
606,606,05/06/2018,Uestra_DE_Dif,-0.315435972,2018-05-06
607,607,05/06/2018,FirstGroup_USA_Dif,0.972078269,2018-05-06
608,608,06/06/2018,ChinaRail_Dif,-0.567244556,2018-06-06
609,609,06/06/2018,HongKongPT_Dif,0.520210038,2018-06-06
610,610,06/06/2018,JapanRail_Dif,1.875484597,2018-06-06
611,611,06/06/2018,SaudiPT_Dif,-0.02004809,2018-06-06
612,612,06/06/2018,TramsRail_FR_Dif,0.547253557,2018-06-06
613,613,06/06/2018,FirstBus_UK_Dif,0.276136418,2018-06-06
614,614,06/06/2018,Uestra_DE_Dif,-0.344159922,2018-06-06
615,615,06/06/2018,FirstGroup_USA_Dif,0.858312238,2018-06-06
616,616,07/06/2018,ChinaRail_Dif,-0.591968338,2018-07-06
617,617,07/06/2018,HongKongPT_Dif,0.448944135,2018-07-06
618,618,07/06/2018,JapanRail_Dif,1.82492811,2018-07-06
619,619,07/06/2018,SaudiPT_Dif,0.025685541,2018-07-06
620,620,07/06/2018,TramsRail_FR_Dif,0.568691347,2018-07-06
621,621,07/06/2018,FirstBus_UK_Dif,0.241631415,2018-07-06
622,622,07/06/2018,Uestra_DE_Dif,-0.331436618,2018-07-06
623,623,07/06/2018,FirstGroup_USA_Dif,0.766046185,2018-07-06
624,624,11/06/2018,ChinaRail_Dif,-0.549551454,2018-11-06
625,625,11/06/2018,HongKongPT_Dif,0.575135753,2018-11-06
626,626,11/06/2018,JapanRail_Dif,1.865790181,2018-11-06
627,627,11/06/2018,SaudiPT_Dif,-0.022827406,2018-11-06
628,628,11/06/2018,TramsRail_FR_Dif,0.53198088,2018-11-06
629,629,11/06/2018,FirstBus_UK_Dif,0.105775595,2018-11-06
630,630,11/06/2018,Uestra_DE_Dif,-0.097734949,2018-11-06
631,631,11/06/2018,FirstGroup_USA_Dif,0.624512021,2018-11-06
632,632,12/06/2018,ChinaRail_Dif,-0.625774082,2018-12-06
633,633,12/06/2018,HongKongPT_Dif,0.564071552,2018-12-06
634,634,12/06/2018,JapanRail_Dif,1.964618908,2018-12-06
635,635,12/06/2018,SaudiPT_Dif,0.000318401,2018-12-06
636,636,12/06/2018,TramsRail_FR_Dif,0.561492652,2018-12-06
637,637,12/06/2018,FirstBus_UK_Dif,0.116640859,2018-12-06
638,638,12/06/2018,Uestra_DE_Dif,0.259692902,2018-12-06
639,639,12/06/2018,FirstGroup_USA_Dif,0.633841102,2018-12-06
640,640,13/06/2018,ChinaRail_Dif,-0.510237694,2018-06-13
641,641,13/06/2018,HongKongPT_Dif,0.670299516,2018-06-13
642,642,13/06/2018,JapanRail_Dif,1.978346742,2018-06-13
643,643,13/06/2018,SaudiPT_Dif,0.007977762,2018-06-13
644,644,13/06/2018,TramsRail_FR_Dif,0.562412396,2018-06-13
645,645,13/06/2018,FirstBus_UK_Dif,0.097045802,2018-06-13
646,646,13/06/2018,Uestra_DE_Dif,0.660920652,2018-06-13
647,647,13/06/2018,FirstGroup_USA_Dif,0.623658503,2018-06-13
648,648,14/06/2018,ChinaRail_Dif,-0.476674293,2018-06-14
649,649,14/06/2018,HongKongPT_Dif,0.634796205,2018-06-14
650,650,14/06/2018,JapanRail_Dif,2.039925945,2018-06-14
651,651,14/06/2018,SaudiPT_Dif,0.005424642,2018-06-14
652,652,14/06/2018,TramsRail_FR_Dif,0.453604136,2018-06-14
653,653,14/06/2018,FirstBus_UK_Dif,0.003245696,2018-06-14
654,654,14/06/2018,Uestra_DE_Dif,0.159065887,2018-06-14
655,655,14/06/2018,FirstGroup_USA_Dif,0.578242535,2018-06-14
656,656,19/06/2018,ChinaRail_Dif,-0.343070438,2018-06-19
657,657,19/06/2018,HongKongPT_Dif,1.023633629,2018-06-19
658,658,19/06/2018,JapanRail_Dif,2.275447448,2018-06-19
659,659,19/06/2018,SaudiPT_Dif,0.049835377,2018-06-19
660,660,19/06/2018,TramsRail_FR_Dif,0.292989848,2018-06-19
661,661,19/06/2018,FirstBus_UK_Dif,0.451706936,2018-06-19
662,662,19/06/2018,Uestra_DE_Dif,1.185662579,2018-06-19
663,663,19/06/2018,FirstGroup_USA_Dif,0.537530842,2018-06-19
664,664,20/06/2018,ChinaRail_Dif,-0.435089902,2018-06-20
665,665,20/06/2018,HongKongPT_Dif,0.901734682,2018-06-20
666,666,20/06/2018,JapanRail_Dif,2.234966747,2018-06-20
667,667,20/06/2018,SaudiPT_Dif,-0.013713847,2018-06-20
668,668,20/06/2018,TramsRail_FR_Dif,0.319311632,2018-06-20
669,669,20/06/2018,FirstBus_UK_Dif,0.427570696,2018-06-20
670,670,20/06/2018,Uestra_DE_Dif,0.766140666,2018-06-20
671,671,20/06/2018,FirstGroup_USA_Dif,0.559458431,2018-06-20
672,672,21/06/2018,ChinaRail_Dif,-0.238844952,2018-06-21
673,673,21/06/2018,HongKongPT_Dif,0.95640028,2018-06-21
674,674,21/06/2018,JapanRail_Dif,2.215787783,2018-06-21
675,675,21/06/2018,SaudiPT_Dif,-0.05308663,2018-06-21
676,676,21/06/2018,TramsRail_FR_Dif,0.400203465,2018-06-21
677,677,21/06/2018,FirstBus_UK_Dif,0.523167009,2018-06-21
678,678,21/06/2018,Uestra_DE_Dif,1.067231306,2018-06-21
679,679,21/06/2018,FirstGroup_USA_Dif,0.554587385,2018-06-21
680,680,25/06/2018,ChinaRail_Dif,-0.228548461,2018-06-25
681,681,25/06/2018,HongKongPT_Dif,1.050470964,2018-06-25
682,682,25/06/2018,JapanRail_Dif,2.13163283,2018-06-25
683,683,25/06/2018,SaudiPT_Dif,-0.070556753,2018-06-25
684,684,25/06/2018,TramsRail_FR_Dif,0.4463962,2018-06-25
685,685,25/06/2018,FirstBus_UK_Dif,0.531126364,2018-06-25
686,686,25/06/2018,Uestra_DE_Dif,0.820807594,2018-06-25
687,687,25/06/2018,FirstGroup_USA_Dif,0.506033343,2018-06-25
688,688,26/06/2018,ChinaRail_Dif,-0.271223804,2018-06-26
689,689,26/06/2018,HongKongPT_Dif,1.130760832,2018-06-26
690,690,26/06/2018,JapanRail_Dif,2.144694691,2018-06-26
691,691,26/06/2018,SaudiPT_Dif,-0.088594301,2018-06-26
692,692,26/06/2018,TramsRail_FR_Dif,0.450088504,2018-06-26
693,693,26/06/2018,FirstBus_UK_Dif,0.466247224,2018-06-26
694,694,26/06/2018,Uestra_DE_Dif,0.844882381,2018-06-26
695,695,26/06/2018,FirstGroup_USA_Dif,0.478473669,2018-06-26
696,696,27/06/2018,ChinaRail_Dif,-0.281851947,2018-06-27
697,697,27/06/2018,HongKongPT_Dif,1.220569115,2018-06-27
698,698,27/06/2018,JapanRail_Dif,2.111149069,2018-06-27
699,699,27/06/2018,SaudiPT_Dif,-0.107768797,2018-06-27
700,700,27/06/2018,TramsRail_FR_Dif,0.38412514,2018-06-27
701,701,27/06/2018,FirstBus_UK_Dif,0.166216734,2018-06-27
702,702,27/06/2018,Uestra_DE_Dif,1.099962379,2018-06-27
703,703,27/06/2018,FirstGroup_USA_Dif,0.521682769,2018-06-27
704,704,28/06/2018,ChinaRail_Dif,-0.330810986,2018-06-28
705,705,28/06/2018,HongKongPT_Dif,1.180917959,2018-06-28
706,706,28/06/2018,JapanRail_Dif,2.071961802,2018-06-28
707,707,28/06/2018,SaudiPT_Dif,-0.10143016,2018-06-28
708,708,28/06/2018,TramsRail_FR_Dif,0.45820624,2018-06-28
709,709,28/06/2018,FirstBus_UK_Dif,0.17761691,2018-06-28
710,710,28/06/2018,Uestra_DE_Dif,0.8830843,2018-06-28
711,711,28/06/2018,FirstGroup_USA_Dif,0.573404221,2018-06-28
712,712,03/07/2018,ChinaRail_Dif,-0.353682697,2018-03-07
713,713,03/07/2018,HongKongPT_Dif,0.993938789,2018-03-07
714,714,03/07/2018,JapanRail_Dif,1.861975447,2018-03-07
715,715,03/07/2018,SaudiPT_Dif,-0.009280347,2018-03-07
716,716,03/07/2018,TramsRail_FR_Dif,0.458885659,2018-03-07
717,717,03/07/2018,FirstBus_UK_Dif,0.276166197,2018-03-07
718,718,03/07/2018,Uestra_DE_Dif,1.099608319,2018-03-07
719,719,03/07/2018,FirstGroup_USA_Dif,0.731187053,2018-03-07
720,720,05/07/2018,ChinaRail_Dif,-0.204968699,2018-05-07
721,721,05/07/2018,HongKongPT_Dif,0.980499875,2018-05-07
722,722,05/07/2018,JapanRail_Dif,1.930090084,2018-05-07
723,723,05/07/2018,SaudiPT_Dif,0.014735853,2018-05-07
724,724,05/07/2018,TramsRail_FR_Dif,0.387692876,2018-05-07
725,725,05/07/2018,FirstBus_UK_Dif,0.344210678,2018-05-07
726,726,05/07/2018,Uestra_DE_Dif,1.150088593,2018-05-07
727,727,05/07/2018,FirstGroup_USA_Dif,0.739786867,2018-05-07
728,728,09/07/2018,ChinaRail_Dif,-0.291698868,2018-09-07
729,729,09/07/2018,HongKongPT_Dif,0.895957071,2018-09-07
730,730,09/07/2018,JapanRail_Dif,1.796187344,2018-09-07
731,731,09/07/2018,SaudiPT_Dif,-0.078135009,2018-09-07
732,732,09/07/2018,TramsRail_FR_Dif,0.34201719,2018-09-07
733,733,09/07/2018,FirstBus_UK_Dif,0.351409699,2018-09-07
734,734,09/07/2018,Uestra_DE_Dif,0.688819836,2018-09-07
735,735,09/07/2018,FirstGroup_USA_Dif,0.704075153,2018-09-07
736,736,10/07/2018,ChinaRail_Dif,-0.242275346,2018-10-07
737,737,10/07/2018,HongKongPT_Dif,0.839908271,2018-10-07
738,738,10/07/2018,JapanRail_Dif,1.6179073,2018-10-07
739,739,10/07/2018,SaudiPT_Dif,-0.142555633,2018-10-07
740,740,10/07/2018,TramsRail_FR_Dif,0.289933466,2018-10-07
741,741,10/07/2018,FirstBus_UK_Dif,0.262331921,2018-10-07
742,742,10/07/2018,Uestra_DE_Dif,0.644697534,2018-10-07
743,743,10/07/2018,FirstGroup_USA_Dif,0.704148758,2018-10-07
744,744,11/07/2018,ChinaRail_Dif,-0.19531366,2018-11-07
745,745,11/07/2018,HongKongPT_Dif,0.94407031,2018-11-07
746,746,11/07/2018,JapanRail_Dif,1.70368642,2018-11-07
747,747,11/07/2018,SaudiPT_Dif,-0.07050811,2018-11-07
748,748,11/07/2018,TramsRail_FR_Dif,0.405494229,2018-11-07
749,749,11/07/2018,FirstBus_UK_Dif,0.44427371,2018-11-07
750,750,11/07/2018,Uestra_DE_Dif,0.77361268,2018-11-07
751,751,11/07/2018,FirstGroup_USA_Dif,0.65296782,2018-11-07
752,752,12/07/2018,ChinaRail_Dif,-0.195190161,2018-12-07
753,753,12/07/2018,HongKongPT_Dif,0.954331668,2018-12-07
754,754,12/07/2018,JapanRail_Dif,1.722115927,2018-12-07
755,755,12/07/2018,SaudiPT_Dif,-0.114162696,2018-12-07
756,756,12/07/2018,TramsRail_FR_Dif,0.330824521,2018-12-07
757,757,12/07/2018,FirstBus_UK_Dif,0.264211374,2018-12-07
758,758,12/07/2018,Uestra_DE_Dif,0.722881472,2018-12-07
759,759,12/07/2018,FirstGroup_USA_Dif,0.631276376,2018-12-07
760,760,16/07/2018,ChinaRail_Dif,-0.154527083,2018-07-16
761,761,16/07/2018,HongKongPT_Dif,0.764378983,2018-07-16
762,762,16/07/2018,JapanRail_Dif,1.654562846,2018-07-16
763,763,16/07/2018,SaudiPT_Dif,-0.170749038,2018-07-16
764,764,16/07/2018,TramsRail_FR_Dif,0.325752251,2018-07-16
765,765,16/07/2018,FirstBus_UK_Dif,0.351730011,2018-07-16
766,766,16/07/2018,Uestra_DE_Dif,0.67736122,2018-07-16
767,767,16/07/2018,FirstGroup_USA_Dif,0.568969336,2018-07-16
768,768,17/07/2018,ChinaRail_Dif,-0.06343434,2018-07-17
769,769,17/07/2018,HongKongPT_Dif,0.865004848,2018-07-17
770,770,17/07/2018,JapanRail_Dif,1.796080556,2018-07-17
771,771,17/07/2018,SaudiPT_Dif,-0.178735555,2018-07-17
772,772,17/07/2018,TramsRail_FR_Dif,0.306916099,2018-07-17
773,773,17/07/2018,FirstBus_UK_Dif,0.266422426,2018-07-17
774,774,17/07/2018,Uestra_DE_Dif,0.610120485,2018-07-17
775,775,17/07/2018,FirstGroup_USA_Dif,0.662099148,2018-07-17
776,776,18/07/2018,ChinaRail_Dif,-0.026305116,2018-07-18
777,777,18/07/2018,HongKongPT_Dif,0.883067829,2018-07-18
778,778,18/07/2018,JapanRail_Dif,1.799136653,2018-07-18
779,779,18/07/2018,SaudiPT_Dif,-0.155288282,2018-07-18
780,780,18/07/2018,TramsRail_FR_Dif,0.271140109,2018-07-18
781,781,18/07/2018,FirstBus_UK_Dif,0.165560647,2018-07-18
782,782,18/07/2018,Uestra_DE_Dif,0.540284398,2018-07-18
783,783,18/07/2018,FirstGroup_USA_Dif,0.831065803,2018-07-18
784,784,19/07/2018,ChinaRail_Dif,-0.101218717,2018-07-19
785,785,19/07/2018,HongKongPT_Dif,1.02863159,2018-07-19
786,786,19/07/2018,JapanRail_Dif,1.741790294,2018-07-19
787,787,19/07/2018,SaudiPT_Dif,-0.173221658,2018-07-19
788,788,19/07/2018,TramsRail_FR_Dif,0.314775662,2018-07-19
789,789,19/07/2018,FirstBus_UK_Dif,0.193469577,2018-07-19
790,790,19/07/2018,Uestra_DE_Dif,0.593564578,2018-07-19
791,791,19/07/2018,FirstGroup_USA_Dif,0.737951236,2018-07-19
792,792,23/07/2018,ChinaRail_Dif,0.134910069,2018-07-23
793,793,23/07/2018,HongKongPT_Dif,0.786275739,2018-07-23
794,794,23/07/2018,JapanRail_Dif,1.877149324,2018-07-23
795,795,23/07/2018,SaudiPT_Dif,-0.117715713,2018-07-23
796,796,23/07/2018,TramsRail_FR_Dif,0.370551691,2018-07-23
797,797,23/07/2018,FirstBus_UK_Dif,0.303399632,2018-07-23
798,798,23/07/2018,Uestra_DE_Dif,0.68568882,2018-07-23
799,799,23/07/2018,FirstGroup_USA_Dif,0.777707755,2018-07-23
800,800,24/07/2018,ChinaRail_Dif,0.630797599,2018-07-24
801,801,24/07/2018,HongKongPT_Dif,0.672025091,2018-07-24
802,802,24/07/2018,JapanRail_Dif,1.871837128,2018-07-24
803,803,24/07/2018,SaudiPT_Dif,-0.156576813,2018-07-24
804,804,24/07/2018,TramsRail_FR_Dif,0.290177608,2018-07-24
805,805,24/07/2018,FirstBus_UK_Dif,0.106750991,2018-07-24
806,806,24/07/2018,Uestra_DE_Dif,0.438482747,2018-07-24
807,807,24/07/2018,FirstGroup_USA_Dif,0.765981449,2018-07-24
808,808,25/07/2018,ChinaRail_Dif,0.472381979,2018-07-25
809,809,25/07/2018,HongKongPT_Dif,0.599410271,2018-07-25
810,810,25/07/2018,JapanRail_Dif,1.839450083,2018-07-25
811,811,25/07/2018,SaudiPT_Dif,-0.258057629,2018-07-25
812,812,25/07/2018,TramsRail_FR_Dif,0.301355544,2018-07-25
813,813,25/07/2018,FirstBus_UK_Dif,0.087232476,2018-07-25
814,814,25/07/2018,Uestra_DE_Dif,0.512104404,2018-07-25
815,815,25/07/2018,FirstGroup_USA_Dif,0.696664327,2018-07-25
816,816,26/07/2018,ChinaRail_Dif,0.359132679,2018-07-26
817,817,26/07/2018,HongKongPT_Dif,0.638695787,2018-07-26
818,818,26/07/2018,JapanRail_Dif,1.968433298,2018-07-26
819,819,26/07/2018,SaudiPT_Dif,-0.221981993,2018-07-26
820,820,26/07/2018,TramsRail_FR_Dif,0.223568109,2018-07-26
821,821,26/07/2018,FirstBus_UK_Dif,0.172625138,2018-07-26
822,822,26/07/2018,Uestra_DE_Dif,0.358318162,2018-07-26
823,823,26/07/2018,FirstGroup_USA_Dif,0.730229052,2018-07-26
824,824,30/07/2018,ChinaRail_Dif,0.639563958,2018-07-30
825,825,30/07/2018,HongKongPT_Dif,0.652191004,2018-07-30
826,826,30/07/2018,JapanRail_Dif,2.05127724,2018-07-30
827,827,30/07/2018,SaudiPT_Dif,-0.325839744,2018-07-30
828,828,30/07/2018,TramsRail_FR_Dif,0.208236945,2018-07-30
829,829,30/07/2018,FirstBus_UK_Dif,-0.037167777,2018-07-30
830,830,30/07/2018,Uestra_DE_Dif,0.365696594,2018-07-30
831,831,30/07/2018,FirstGroup_USA_Dif,0.821496127,2018-07-30
832,832,31/07/2018,ChinaRail_Dif,0.719895541,2018-07-31
833,833,31/07/2018,HongKongPT_Dif,0.809998864,2018-07-31
834,834,31/07/2018,JapanRail_Dif,1.955008786,2018-07-31
835,835,31/07/2018,SaudiPT_Dif,-0.334186516,2018-07-31
836,836,31/07/2018,TramsRail_FR_Dif,0.179386743,2018-07-31
837,837,31/07/2018,FirstBus_UK_Dif,-0.074433151,2018-07-31
838,838,31/07/2018,Uestra_DE_Dif,0.360813568,2018-07-31
839,839,31/07/2018,FirstGroup_USA_Dif,0.70587044,2018-07-31
840,840,01/08/2018,ChinaRail_Dif,0.826129419,2018-01-08
841,841,01/08/2018,HongKongPT_Dif,0.878099174,2018-01-08
842,842,01/08/2018,JapanRail_Dif,1.84882308,2018-01-08
843,843,01/08/2018,SaudiPT_Dif,-0.349855462,2018-01-08
844,844,01/08/2018,TramsRail_FR_Dif,0.19796402,2018-01-08
845,845,01/08/2018,FirstBus_UK_Dif,0.099812196,2018-01-08
846,846,01/08/2018,Uestra_DE_Dif,0.406601652,2018-01-08
847,847,01/08/2018,FirstGroup_USA_Dif,0.751637294,2018-01-08
848,848,02/08/2018,ChinaRail_Dif,0.906810331,2018-02-08
849,849,02/08/2018,HongKongPT_Dif,1.054114007,2018-02-08
850,850,02/08/2018,JapanRail_Dif,1.825242914,2018-02-08
851,851,02/08/2018,SaudiPT_Dif,-0.367893549,2018-02-08
852,852,02/08/2018,TramsRail_FR_Dif,0.251685884,2018-02-08
853,853,02/08/2018,FirstBus_UK_Dif,0.238737547,2018-02-08
854,854,02/08/2018,Uestra_DE_Dif,0.534178947,2018-02-08
855,855,02/08/2018,FirstGroup_USA_Dif,0.689576407,2018-02-08
856,856,06/08/2018,ChinaRail_Dif,0.591292702,2018-06-08
857,857,06/08/2018,HongKongPT_Dif,1.024599224,2018-06-08
858,858,06/08/2018,JapanRail_Dif,1.779326742,2018-06-08
859,859,06/08/2018,SaudiPT_Dif,-0.436547871,2018-06-08
860,860,06/08/2018,TramsRail_FR_Dif,0.228409566,2018-06-08
861,861,06/08/2018,FirstBus_UK_Dif,-0.02257318,2018-06-08
862,862,06/08/2018,Uestra_DE_Dif,0.499475168,2018-06-08
863,863,06/08/2018,FirstGroup_USA_Dif,0.810266489,2018-06-08
864,864,07/08/2018,ChinaRail_Dif,0.670816283,2018-07-08
865,865,07/08/2018,HongKongPT_Dif,0.903920217,2018-07-08
866,866,07/08/2018,JapanRail_Dif,1.783113779,2018-07-08
867,867,07/08/2018,SaudiPT_Dif,-0.387275371,2018-07-08
868,868,07/08/2018,TramsRail_FR_Dif,0.165004086,2018-07-08
869,869,07/08/2018,FirstBus_UK_Dif,-0.164611065,2018-07-08
870,870,07/08/2018,Uestra_DE_Dif,0.466041957,2018-07-08
871,871,07/08/2018,FirstGroup_USA_Dif,0.796195528,2018-07-08
872,872,08/08/2018,ChinaRail_Dif,0.773290506,2018-08-08
873,873,08/08/2018,HongKongPT_Dif,0.87292695,2018-08-08
874,874,08/08/2018,JapanRail_Dif,1.742910383,2018-08-08
875,875,08/08/2018,SaudiPT_Dif,-0.3230066,2018-08-08
876,876,08/08/2018,TramsRail_FR_Dif,0.192892451,2018-08-08
877,877,08/08/2018,FirstBus_UK_Dif,-0.206195858,2018-08-08
878,878,08/08/2018,Uestra_DE_Dif,0.475841977,2018-08-08
879,879,08/08/2018,FirstGroup_USA_Dif,0.840782777,2018-08-08
880,880,09/08/2018,ChinaRail_Dif,0.703534381,2018-09-08
881,881,09/08/2018,HongKongPT_Dif,0.803170825,2018-09-08
882,882,09/08/2018,JapanRail_Dif,1.763580656,2018-09-08
883,883,09/08/2018,SaudiPT_Dif,-0.32543154,2018-09-08
884,884,09/08/2018,TramsRail_FR_Dif,0.192389434,2018-09-08
885,885,09/08/2018,FirstBus_UK_Dif,-0.17580735,2018-09-08
886,886,09/08/2018,Uestra_DE_Dif,0.447365608,2018-09-08
887,887,09/08/2018,FirstGroup_USA_Dif,0.807595104,2018-09-08
888,888,13/08/2018,ChinaRail_Dif,0.815804997,2018-08-13
889,889,13/08/2018,HongKongPT_Dif,0.991708578,2018-08-13
890,890,13/08/2018,JapanRail_Dif,1.872817844,2018-08-13
891,891,13/08/2018,SaudiPT_Dif,-0.151494402,2018-08-13
892,892,13/08/2018,TramsRail_FR_Dif,0.321600426,2018-08-13
893,893,13/08/2018,FirstBus_UK_Dif,-0.052435613,2018-08-13
894,894,13/08/2018,Uestra_DE_Dif,0.659662584,2018-08-13
895,895,13/08/2018,FirstGroup_USA_Dif,0.817519282,2018-08-13
896,896,14/08/2018,ChinaRail_Dif,1.010425733,2018-08-14
897,897,14/08/2018,HongKongPT_Dif,1.043328703,2018-08-14
898,898,14/08/2018,JapanRail_Dif,1.87882411,2018-08-14
899,899,14/08/2018,SaudiPT_Dif,-0.12139661,2018-08-14
900,900,14/08/2018,TramsRail_FR_Dif,0.334401769,2018-08-14
901,901,14/08/2018,FirstBus_UK_Dif,0.13220951,2018-08-14
902,902,14/08/2018,Uestra_DE_Dif,0.914589574,2018-08-14
903,903,14/08/2018,FirstGroup_USA_Dif,0.821689709,2018-08-14
904,904,15/08/2018,ChinaRail_Dif,1.035776309,2018-08-15
905,905,15/08/2018,HongKongPT_Dif,1.164013201,2018-08-15
906,906,15/08/2018,JapanRail_Dif,1.935728518,2018-08-15
907,907,15/08/2018,SaudiPT_Dif,-0.075061753,2018-08-15
908,908,15/08/2018,TramsRail_FR_Dif,0.47548033,2018-08-15
909,909,15/08/2018,FirstBus_UK_Dif,0.237705882,2018-08-15
910,910,15/08/2018,Uestra_DE_Dif,1.122109651,2018-08-15
911,911,15/08/2018,FirstGroup_USA_Dif,0.771077249,2018-08-15
912,912,16/08/2018,ChinaRail_Dif,1.098608868,2018-08-16
913,913,16/08/2018,HongKongPT_Dif,1.053430281,2018-08-16
914,914,16/08/2018,JapanRail_Dif,1.795323936,2018-08-16
915,915,16/08/2018,SaudiPT_Dif,-0.108560327,2018-08-16
916,916,16/08/2018,TramsRail_FR_Dif,0.412549104,2018-08-16
917,917,16/08/2018,FirstBus_UK_Dif,0.133354283,2018-08-16
918,918,16/08/2018,Uestra_DE_Dif,0.74098407,2018-08-16
919,919,16/08/2018,FirstGroup_USA_Dif,0.789552389,2018-08-16
920,920,20/08/2018,ChinaRail_Dif,0.729834046,2018-08-20
921,921,20/08/2018,HongKongPT_Dif,0.740040988,2018-08-20
922,922,20/08/2018,JapanRail_Dif,1.745610103,2018-08-20
923,923,20/08/2018,SaudiPT_Dif,-0.149789817,2018-08-20
924,924,20/08/2018,TramsRail_FR_Dif,0.368540322,2018-08-20
925,925,20/08/2018,FirstBus_UK_Dif,0.117895315,2018-08-20
926,926,20/08/2018,Uestra_DE_Dif,0.678018188,2018-08-20
927,927,20/08/2018,FirstGroup_USA_Dif,0.839681458,2018-08-20
928,928,21/08/2018,ChinaRail_Dif,0.714929836,2018-08-21
929,929,21/08/2018,HongKongPT_Dif,0.69653633,2018-08-21
930,930,21/08/2018,JapanRail_Dif,1.699523657,2018-08-21
931,931,21/08/2018,SaudiPT_Dif,-0.184577729,2018-08-21
932,932,21/08/2018,TramsRail_FR_Dif,0.326944901,2018-08-21
933,933,21/08/2018,FirstBus_UK_Dif,0.31005004,2018-08-21
934,934,21/08/2018,Uestra_DE_Dif,0.642437751,2018-08-21
935,935,21/08/2018,FirstGroup_USA_Dif,0.845360744,2018-08-21
936,936,22/08/2018,ChinaRail_Dif,0.656263612,2018-08-22
937,937,22/08/2018,HongKongPT_Dif,0.878625826,2018-08-22
938,938,22/08/2018,JapanRail_Dif,1.664455625,2018-08-22
939,939,22/08/2018,SaudiPT_Dif,-0.18586599,2018-08-22
940,940,22/08/2018,TramsRail_FR_Dif,0.309689361,2018-08-22
941,941,22/08/2018,FirstBus_UK_Dif,0.331489158,2018-08-22
942,942,22/08/2018,Uestra_DE_Dif,0.641628377,2018-08-22
943,943,22/08/2018,FirstGroup_USA_Dif,0.747702283,2018-08-22
944,944,23/08/2018,ChinaRail_Dif,0.694806866,2018-08-23
945,945,23/08/2018,HongKongPT_Dif,0.917169079,2018-08-23
946,946,23/08/2018,JapanRail_Dif,1.636713614,2018-08-23
947,947,23/08/2018,SaudiPT_Dif,-0.179423336,2018-08-23
948,948,23/08/2018,TramsRail_FR_Dif,0.311528147,2018-08-23
949,949,23/08/2018,FirstBus_UK_Dif,0.364487605,2018-08-23
950,950,23/08/2018,Uestra_DE_Dif,0.655087238,2018-08-23
951,951,23/08/2018,FirstGroup_USA_Dif,0.719728636,2018-08-23
952,952,28/08/2018,ChinaRail_Dif,0.603802602,2018-08-28
953,953,28/08/2018,HongKongPT_Dif,0.528209286,2018-08-28
954,954,28/08/2018,JapanRail_Dif,1.571261029,2018-08-28
955,955,28/08/2018,SaudiPT_Dif,0.064415806,2018-08-28
956,956,28/08/2018,TramsRail_FR_Dif,0.217188134,2018-08-28
957,957,28/08/2018,FirstBus_UK_Dif,0.2337107,2018-08-28
958,958,28/08/2018,Uestra_DE_Dif,0.546828433,2018-08-28
959,959,28/08/2018,FirstGroup_USA_Dif,0.617893696,2018-08-28
960,960,29/08/2018,ChinaRail_Dif,0.604649381,2018-08-29
961,961,29/08/2018,HongKongPT_Dif,0.509988739,2018-08-29
962,962,29/08/2018,JapanRail_Dif,1.527138061,2018-08-29
963,963,29/08/2018,SaudiPT_Dif,0.026483676,2018-08-29
964,964,29/08/2018,TramsRail_FR_Dif,0.19371117,2018-08-29
965,965,29/08/2018,FirstBus_UK_Dif,0.31721083,2018-08-29
966,966,29/08/2018,Uestra_DE_Dif,0.523911201,2018-08-29
967,967,29/08/2018,FirstGroup_USA_Dif,0.512538624,2018-08-29
968,968,30/08/2018,ChinaRail_Dif,0.589793313,2018-08-30
969,969,30/08/2018,HongKongPT_Dif,0.58093347,2018-08-30
970,970,30/08/2018,JapanRail_Dif,1.552190652,2018-08-30
971,971,30/08/2018,SaudiPT_Dif,0.067969036,2018-08-30
972,972,30/08/2018,TramsRail_FR_Dif,0.227145357,2018-08-30
973,973,30/08/2018,FirstBus_UK_Dif,0.390492912,2018-08-30
974,974,30/08/2018,Uestra_DE_Dif,0.569023174,2018-08-30
975,975,30/08/2018,FirstGroup_USA_Dif,0.689100322,2018-08-30
976,976,04/09/2018,ChinaRail_Dif,0.79593567,2018-04-09
977,977,04/09/2018,HongKongPT_Dif,0.763532439,2018-04-09
978,978,04/09/2018,JapanRail_Dif,1.564857711,2018-04-09
979,979,04/09/2018,SaudiPT_Dif,0.079460508,2018-04-09
980,980,04/09/2018,TramsRail_FR_Dif,0.42162938,2018-04-09
981,981,04/09/2018,FirstBus_UK_Dif,0.55879066,2018-04-09
982,982,04/09/2018,Uestra_DE_Dif,0.759018277,2018-04-09
983,983,04/09/2018,FirstGroup_USA_Dif,0.598386889,2018-04-09
984,984,05/09/2018,ChinaRail_Dif,0.981924149,2018-05-09
985,985,05/09/2018,HongKongPT_Dif,0.545217493,2018-05-09
986,986,05/09/2018,JapanRail_Dif,1.601083897,2018-05-09
987,987,05/09/2018,SaudiPT_Dif,0.107077886,2018-05-09
988,988,05/09/2018,TramsRail_FR_Dif,0.540135988,2018-05-09
989,989,05/09/2018,FirstBus_UK_Dif,0.715623336,2018-05-09
990,990,05/09/2018,Uestra_DE_Dif,0.872568386,2018-05-09
991,991,05/09/2018,FirstGroup_USA_Dif,0.66224067,2018-05-09
992,992,06/09/2018,ChinaRail_Dif,1.152880368,2018-06-09
993,993,06/09/2018,HongKongPT_Dif,0.802283934,2018-06-09
994,994,06/09/2018,JapanRail_Dif,1.487452359,2018-06-09
995,995,06/09/2018,SaudiPT_Dif,0.138463883,2018-06-09
996,996,06/09/2018,TramsRail_FR_Dif,0.563671181,2018-06-09
997,997,06/09/2018,FirstBus_UK_Dif,0.78602691,2018-06-09
998,998,06/09/2018,Uestra_DE_Dif,0.929567505,2018-06-09
999,999,06/09/2018,FirstGroup_USA_Dif,0.93050206,2018-06-09
1000,1000,10/09/2018,ChinaRail_Dif,1.244934427,2018-10-09
1001,1001,10/09/2018,HongKongPT_Dif,0.964352496,2018-10-09
1002,1002,10/09/2018,JapanRail_Dif,1.531221851,2018-10-09
1003,1003,10/09/2018,SaudiPT_Dif,0.113520002,2018-10-09
1004,1004,10/09/2018,TramsRail_FR_Dif,0.526616249,2018-10-09
1005,1005,10/09/2018,FirstBus_UK_Dif,0.830362307,2018-10-09
1006,1006,10/09/2018,Uestra_DE_Dif,0.908770715,2018-10-09
1007,1007,10/09/2018,FirstGroup_USA_Dif,1.056070802,2018-10-09
1008,1008,11/09/2018,ChinaRail_Dif,1.327185803,2018-11-09
1009,1009,11/09/2018,HongKongPT_Dif,0.836560364,2018-11-09
1010,1010,11/09/2018,JapanRail_Dif,1.51786202,2018-11-09
1011,1011,11/09/2018,SaudiPT_Dif,0.08002089,2018-11-09
1012,1012,11/09/2018,TramsRail_FR_Dif,0.506271044,2018-11-09
1013,1013,11/09/2018,FirstBus_UK_Dif,0.81134291,2018-11-09
1014,1014,11/09/2018,Uestra_DE_Dif,0.919520557,2018-11-09
1015,1015,11/09/2018,FirstGroup_USA_Dif,1.033820524,2018-11-09
1016,1016,12/09/2018,ChinaRail_Dif,1.40617417,2018-12-09
1017,1017,12/09/2018,HongKongPT_Dif,0.858348379,2018-12-09
1018,1018,12/09/2018,JapanRail_Dif,1.555630498,2018-12-09
1019,1019,12/09/2018,SaudiPT_Dif,0.080997808,2018-12-09
1020,1020,12/09/2018,TramsRail_FR_Dif,0.436816724,2018-12-09
1021,1021,12/09/2018,FirstBus_UK_Dif,0.687012155,2018-12-09
1022,1022,12/09/2018,Uestra_DE_Dif,0.878026923,2018-12-09
1023,1023,12/09/2018,FirstGroup_USA_Dif,0.949486996,2018-12-09
1024,1024,13/09/2018,ChinaRail_Dif,1.380065039,2018-09-13
1025,1025,13/09/2018,HongKongPT_Dif,0.670170228,2018-09-13
1026,1026,13/09/2018,JapanRail_Dif,1.678155759,2018-09-13
1027,1027,13/09/2018,SaudiPT_Dif,0.119521653,2018-09-13
1028,1028,13/09/2018,TramsRail_FR_Dif,0.442577925,2018-09-13
1029,1029,13/09/2018,FirstBus_UK_Dif,0.634473768,2018-09-13
1030,1030,13/09/2018,Uestra_DE_Dif,0.862474405,2018-09-13
1031,1031,13/09/2018,FirstGroup_USA_Dif,0.893618222,2018-09-13
1032,1032,18/09/2018,ChinaRail_Dif,1.7512101,2018-09-18
1033,1033,18/09/2018,HongKongPT_Dif,0.106113039,2018-09-18
1034,1034,18/09/2018,JapanRail_Dif,1.5846336,2018-09-18
1035,1035,18/09/2018,SaudiPT_Dif,0.182431214,2018-09-18
1036,1036,18/09/2018,TramsRail_FR_Dif,0.391327652,2018-09-18
1037,1037,18/09/2018,FirstBus_UK_Dif,0.587271869,2018-09-18
1038,1038,18/09/2018,Uestra_DE_Dif,1.074679135,2018-09-18
1039,1039,18/09/2018,FirstGroup_USA_Dif,0.858235119,2018-09-18
1040,1040,19/09/2018,ChinaRail_Dif,1.774900597,2018-09-19
1041,1041,19/09/2018,HongKongPT_Dif,0.438771416,2018-09-19
1042,1042,19/09/2018,JapanRail_Dif,1.613748496,2018-09-19
1043,1043,19/09/2018,SaudiPT_Dif,0.150323786,2018-09-19
1044,1044,19/09/2018,TramsRail_FR_Dif,0.34829544,2018-09-19
1045,1045,19/09/2018,FirstBus_UK_Dif,0.529524542,2018-09-19
1046,1046,19/09/2018,Uestra_DE_Dif,0.75312533,2018-09-19
1047,1047,19/09/2018,FirstGroup_USA_Dif,0.881788102,2018-09-19
1048,1048,20/09/2018,ChinaRail_Dif,1.688406054,2018-09-20
1049,1049,20/09/2018,HongKongPT_Dif,0.298047111,2018-09-20
1050,1050,20/09/2018,JapanRail_Dif,1.586057384,2018-09-20
1051,1051,20/09/2018,SaudiPT_Dif,0.092392901,2018-09-20
1052,1052,20/09/2018,TramsRail_FR_Dif,0.265177561,2018-09-20
1053,1053,20/09/2018,FirstBus_UK_Dif,0.504173232,2018-09-20
1054,1054,20/09/2018,Uestra_DE_Dif,0.961757449,2018-09-20
1055,1055,20/09/2018,FirstGroup_USA_Dif,0.820889376,2018-09-20
1056,1056,26/09/2018,ChinaRail_Dif,1.564459024,2018-09-26
1057,1057,26/09/2018,HongKongPT_Dif,0.263181909,2018-09-26
1058,1058,26/09/2018,JapanRail_Dif,1.731075802,2018-09-26
1059,1059,26/09/2018,SaudiPT_Dif,-0.068867387,2018-09-26
1060,1060,26/09/2018,TramsRail_FR_Dif,0.177331877,2018-09-26
1061,1061,26/09/2018,FirstBus_UK_Dif,0.135155846,2018-09-26
1062,1062,26/09/2018,Uestra_DE_Dif,0.360986163,2018-09-26
1063,1063,26/09/2018,FirstGroup_USA_Dif,0.762612992,2018-09-26
1064,1064,27/09/2018,ChinaRail_Dif,1.802640601,2018-09-27
1065,1065,27/09/2018,HongKongPT_Dif,0.291628318,2018-09-27
1066,1066,27/09/2018,JapanRail_Dif,1.746251902,2018-09-27
1067,1067,27/09/2018,SaudiPT_Dif,-0.06675481,2018-09-27
1068,1068,27/09/2018,TramsRail_FR_Dif,0.137561211,2018-09-27
1069,1069,27/09/2018,FirstBus_UK_Dif,0.084243602,2018-09-27
1070,1070,27/09/2018,Uestra_DE_Dif,0.327740433,2018-09-27
1071,1071,27/09/2018,FirstGroup_USA_Dif,0.70510335,2018-09-27
1072,1072,02/10/2018,ChinaRail_Dif,1.844350821,2018-02-10
1073,1073,02/10/2018,HongKongPT_Dif,0.457273448,2018-02-10
1074,1074,02/10/2018,JapanRail_Dif,1.574510981,2018-02-10
1075,1075,02/10/2018,SaudiPT_Dif,-0.079430583,2018-02-10
1076,1076,02/10/2018,TramsRail_FR_Dif,0.241757424,2018-02-10
1077,1077,02/10/2018,FirstBus_UK_Dif,0.082196922,2018-02-10
1078,1078,02/10/2018,Uestra_DE_Dif,0.681761567,2018-02-10
1079,1079,02/10/2018,FirstGroup_USA_Dif,0.6227371,2018-02-10
1080,1080,04/10/2018,ChinaRail_Dif,2.119071464,2018-04-10
1081,1081,04/10/2018,HongKongPT_Dif,0.356601008,2018-04-10
1082,1082,04/10/2018,JapanRail_Dif,1.528305838,2018-04-10
1083,1083,04/10/2018,SaudiPT_Dif,-0.037582315,2018-04-10
1084,1084,04/10/2018,TramsRail_FR_Dif,0.323712118,2018-04-10
1085,1085,04/10/2018,FirstBus_UK_Dif,0.329239673,2018-04-10
1086,1086,04/10/2018,Uestra_DE_Dif,0.71081998,2018-04-10
1087,1087,04/10/2018,FirstGroup_USA_Dif,0.678034829,2018-04-10
1088,1088,09/10/2018,ChinaRail_Dif,2.388834106,2018-09-10
1089,1089,09/10/2018,HongKongPT_Dif,0.664806169,2018-09-10
1090,1090,09/10/2018,JapanRail_Dif,1.718090576,2018-09-10
1091,1091,09/10/2018,SaudiPT_Dif,-0.088297909,2018-09-10
1092,1092,09/10/2018,TramsRail_FR_Dif,0.456328477,2018-09-10
1093,1093,09/10/2018,FirstBus_UK_Dif,0.66694058,2018-09-10
1094,1094,09/10/2018,Uestra_DE_Dif,0.63435591,2018-09-10
1095,1095,09/10/2018,FirstGroup_USA_Dif,0.666274725,2018-09-10
1096,1096,10/10/2018,ChinaRail_Dif,2.488035349,2018-10-10
1097,1097,10/10/2018,HongKongPT_Dif,0.659139286,2018-10-10
1098,1098,10/10/2018,JapanRail_Dif,1.805194608,2018-10-10
1099,1099,10/10/2018,SaudiPT_Dif,0.079197113,2018-10-10
1100,1100,10/10/2018,TramsRail_FR_Dif,0.617722778,2018-10-10
1101,1101,10/10/2018,FirstBus_UK_Dif,0.798875941,2018-10-10
1102,1102,10/10/2018,Uestra_DE_Dif,0.811433695,2018-10-10
1103,1103,10/10/2018,FirstGroup_USA_Dif,0.813601616,2018-10-10
1104,1104,11/10/2018,ChinaRail_Dif,2.224186257,2018-11-10
1105,1105,11/10/2018,HongKongPT_Dif,0.738184985,2018-11-10
1106,1106,11/10/2018,JapanRail_Dif,1.820629109,2018-11-10
1107,1107,11/10/2018,SaudiPT_Dif,-0.00559064,2018-11-10
1108,1108,11/10/2018,TramsRail_FR_Dif,0.761186638,2018-11-10
1109,1109,11/10/2018,FirstBus_UK_Dif,0.894053144,2018-11-10
1110,1110,11/10/2018,Uestra_DE_Dif,0.927258413,2018-11-10
1111,1111,11/10/2018,FirstGroup_USA_Dif,0.874197622,2018-11-10
1112,1112,15/10/2018,ChinaRail_Dif,2.231158217,2018-10-15
1113,1113,15/10/2018,HongKongPT_Dif,0.687956051,2018-10-15
1114,1114,15/10/2018,JapanRail_Dif,1.59453954,2018-10-15
1115,1115,15/10/2018,SaudiPT_Dif,0.048363053,2018-10-15
1116,1116,15/10/2018,TramsRail_FR_Dif,0.777422813,2018-10-15
1117,1117,15/10/2018,FirstBus_UK_Dif,0.69313628,2018-10-15
1118,1118,15/10/2018,Uestra_DE_Dif,0.877215727,2018-10-15
1119,1119,15/10/2018,FirstGroup_USA_Dif,0.749696911,2018-10-15
1120,1120,16/10/2018,ChinaRail_Dif,1.930787125,2018-10-16
1121,1121,16/10/2018,HongKongPT_Dif,0.683121468,2018-10-16
1122,1122,16/10/2018,JapanRail_Dif,1.479184523,2018-10-16
1123,1123,16/10/2018,SaudiPT_Dif,-0.174022,2018-10-16
1124,1124,16/10/2018,TramsRail_FR_Dif,0.665381771,2018-10-16
1125,1125,16/10/2018,FirstBus_UK_Dif,0.721295302,2018-10-16
1126,1126,16/10/2018,Uestra_DE_Dif,0.768589145,2018-10-16
1127,1127,16/10/2018,FirstGroup_USA_Dif,0.777465323,2018-10-16
1128,1128,18/10/2018,ChinaRail_Dif,1.932954068,2018-10-18
1129,1129,18/10/2018,HongKongPT_Dif,0.685288411,2018-10-18
1130,1130,18/10/2018,JapanRail_Dif,1.564394757,2018-10-18
1131,1131,18/10/2018,SaudiPT_Dif,-0.103158991,2018-10-18
1132,1132,18/10/2018,TramsRail_FR_Dif,0.596778887,2018-10-18
1133,1133,18/10/2018,FirstBus_UK_Dif,0.666481489,2018-10-18
1134,1134,18/10/2018,Uestra_DE_Dif,0.89390555,2018-10-18
1135,1135,18/10/2018,FirstGroup_USA_Dif,0.83258531,2018-10-18
1136,1136,22/10/2018,ChinaRail_Dif,1.889117305,2018-10-22
1137,1137,22/10/2018,HongKongPT_Dif,0.488916833,2018-10-22
1138,1138,22/10/2018,JapanRail_Dif,1.569973398,2018-10-22
1139,1139,22/10/2018,SaudiPT_Dif,-0.223765816,2018-10-22
1140,1140,22/10/2018,TramsRail_FR_Dif,0.68798644,2018-10-22
1141,1141,22/10/2018,FirstBus_UK_Dif,0.341366826,2018-10-22
1142,1142,22/10/2018,Uestra_DE_Dif,0.937298828,2018-10-22
1143,1143,22/10/2018,FirstGroup_USA_Dif,0.667590861,2018-10-22
1144,1144,23/10/2018,ChinaRail_Dif,1.839378304,2018-10-23
1145,1145,23/10/2018,HongKongPT_Dif,0.715646473,2018-10-23
1146,1146,23/10/2018,JapanRail_Dif,1.515320571,2018-10-23
1147,1147,23/10/2018,SaudiPT_Dif,-0.127486803,2018-10-23
1148,1148,23/10/2018,TramsRail_FR_Dif,0.811004773,2018-10-23
1149,1149,23/10/2018,FirstBus_UK_Dif,0.475019194,2018-10-23
1150,1150,23/10/2018,Uestra_DE_Dif,1.10457006,2018-10-23
1151,1151,23/10/2018,FirstGroup_USA_Dif,0.690235597,2018-10-23
1152,1152,24/10/2018,ChinaRail_Dif,1.752178319,2018-10-24
1153,1153,24/10/2018,HongKongPT_Dif,0.742848277,2018-10-24
1154,1154,24/10/2018,JapanRail_Dif,1.603074944,2018-10-24
1155,1155,24/10/2018,SaudiPT_Dif,-0.040850137,2018-10-24
1156,1156,24/10/2018,TramsRail_FR_Dif,0.831982082,2018-10-24
1157,1157,24/10/2018,FirstBus_UK_Dif,0.172369218,2018-10-24
1158,1158,24/10/2018,Uestra_DE_Dif,1.159857017,2018-10-24
1159,1159,24/10/2018,FirstGroup_USA_Dif,0.820480097,2018-10-24
1160,1160,25/10/2018,ChinaRail_Dif,1.738145766,2018-10-25
1161,1161,25/10/2018,HongKongPT_Dif,0.814616523,2018-10-25
1162,1162,25/10/2018,JapanRail_Dif,1.648376543,2018-10-25
1163,1163,25/10/2018,SaudiPT_Dif,-0.070884066,2018-10-25
1164,1164,25/10/2018,TramsRail_FR_Dif,0.718173813,2018-10-25
1165,1165,25/10/2018,FirstBus_UK_Dif,0.280927499,2018-10-25
1166,1166,25/10/2018,Uestra_DE_Dif,1.08260265,2018-10-25
1167,1167,25/10/2018,FirstGroup_USA_Dif,0.771570865,2018-10-25
1168,1168,29/10/2018,ChinaRail_Dif,1.751290281,2018-10-29
1169,1169,29/10/2018,HongKongPT_Dif,0.865894066,2018-10-29
1170,1170,29/10/2018,JapanRail_Dif,1.815824746,2018-10-29
1171,1171,29/10/2018,SaudiPT_Dif,-0.030166741,2018-10-29
1172,1172,29/10/2018,TramsRail_FR_Dif,0.779883625,2018-10-29
1173,1173,29/10/2018,FirstBus_UK_Dif,0.389738222,2018-10-29
1174,1174,29/10/2018,Uestra_DE_Dif,1.318645309,2018-10-29
1175,1175,29/10/2018,FirstGroup_USA_Dif,0.832268293,2018-10-29
1176,1176,30/10/2018,ChinaRail_Dif,1.767293398,2018-10-30
1177,1177,30/10/2018,HongKongPT_Dif,0.627156563,2018-10-30
1178,1178,30/10/2018,JapanRail_Dif,1.605419731,2018-10-30
1179,1179,30/10/2018,SaudiPT_Dif,-0.087321472,2018-10-30
1180,1180,30/10/2018,TramsRail_FR_Dif,0.795430168,2018-10-30
1181,1181,30/10/2018,FirstBus_UK_Dif,0.444440479,2018-10-30
1182,1182,30/10/2018,Uestra_DE_Dif,1.095800865,2018-10-30
1183,1183,30/10/2018,FirstGroup_USA_Dif,0.847168441,2018-10-30
1184,1184,31/10/2018,ChinaRail_Dif,1.913899528,2018-10-31
1185,1185,31/10/2018,HongKongPT_Dif,0.516360835,2018-10-31
1186,1186,31/10/2018,JapanRail_Dif,1.667483336,2018-10-31
1187,1187,31/10/2018,SaudiPT_Dif,-0.093299641,2018-10-31
1188,1188,31/10/2018,TramsRail_FR_Dif,0.630328129,2018-10-31
1189,1189,31/10/2018,FirstBus_UK_Dif,0.186964544,2018-10-31
1190,1190,31/10/2018,Uestra_DE_Dif,0.988692429,2018-10-31
1191,1191,31/10/2018,FirstGroup_USA_Dif,0.745813129,2018-10-31
1192,1192,01/11/2018,ChinaRail_Dif,2.182126044,2018-01-11
1193,1193,01/11/2018,HongKongPT_Dif,0.212273251,2018-01-11
1194,1194,01/11/2018,JapanRail_Dif,1.730607751,2018-01-11
1195,1195,01/11/2018,SaudiPT_Dif,-0.073869275,2018-01-11
1196,1196,01/11/2018,TramsRail_FR_Dif,0.641334183,2018-01-11
1197,1197,01/11/2018,FirstBus_UK_Dif,0.204491424,2018-01-11
1198,1198,01/11/2018,Uestra_DE_Dif,0.872619043,2018-01-11
1199,1199,01/11/2018,FirstGroup_USA_Dif,0.696922263,2018-01-11
1200,1200,05/11/2018,ChinaRail_Dif,2.036409981,2018-05-11
1201,1201,05/11/2018,HongKongPT_Dif,0.248000858,2018-05-11
1202,1202,05/11/2018,JapanRail_Dif,1.488224883,2018-05-11
1203,1203,05/11/2018,SaudiPT_Dif,-0.079695323,2018-05-11
1204,1204,05/11/2018,TramsRail_FR_Dif,0.618905349,2018-05-11
1205,1205,05/11/2018,FirstBus_UK_Dif,0.234881878,2018-05-11
1206,1206,05/11/2018,Uestra_DE_Dif,0.548929486,2018-05-11
1207,1207,05/11/2018,FirstGroup_USA_Dif,0.571656649,2018-05-11
1208,1208,06/11/2018,ChinaRail_Dif,2.088833925,2018-06-11
1209,1209,06/11/2018,HongKongPT_Dif,0.195557217,2018-06-11
1210,1210,06/11/2018,JapanRail_Dif,1.491644707,2018-06-11
1211,1211,06/11/2018,SaudiPT_Dif,-0.018467022,2018-06-11
1212,1212,06/11/2018,TramsRail_FR_Dif,0.65654959,2018-06-11
1213,1213,06/11/2018,FirstBus_UK_Dif,0.415429844,2018-06-11
1214,1214,06/11/2018,Uestra_DE_Dif,0.556033554,2018-06-11
1215,1215,06/11/2018,FirstGroup_USA_Dif,0.554384716,2018-06-11
1216,1216,07/11/2018,ChinaRail_Dif,2.138521074,2018-07-11
1217,1217,07/11/2018,HongKongPT_Dif,0.188044014,2018-07-11
1218,1218,07/11/2018,JapanRail_Dif,1.5475353,2018-07-11
1219,1219,07/11/2018,SaudiPT_Dif,-0.038825607,2018-07-11
1220,1220,07/11/2018,TramsRail_FR_Dif,0.566390868,2018-07-11
1221,1221,07/11/2018,FirstBus_UK_Dif,0.284800608,2018-07-11
1222,1222,07/11/2018,Uestra_DE_Dif,0.492646327,2018-07-11
1223,1223,07/11/2018,FirstGroup_USA_Dif,0.42793496,2018-07-11
1224,1224,08/11/2018,ChinaRail_Dif,2.039758241,2018-08-11
1225,1225,08/11/2018,HongKongPT_Dif,0.165547776,2018-08-11
1226,1226,08/11/2018,JapanRail_Dif,1.44618513,2018-08-11
1227,1227,08/11/2018,SaudiPT_Dif,-0.011256985,2018-08-11
1228,1228,08/11/2018,TramsRail_FR_Dif,0.575715286,2018-08-11
1229,1229,08/11/2018,FirstBus_UK_Dif,0.31621865,2018-08-11
1230,1230,08/11/2018,Uestra_DE_Dif,0.527282821,2018-08-11
1231,1231,08/11/2018,FirstGroup_USA_Dif,0.490208436,2018-08-11
1232,1232,12/11/2018,ChinaRail_Dif,2.197344913,2018-12-11
1233,1233,12/11/2018,HongKongPT_Dif,0.45363243,2018-12-11
1234,1234,12/11/2018,JapanRail_Dif,1.703060683,2018-12-11
1235,1235,12/11/2018,SaudiPT_Dif,0.02162579,2018-12-11
1236,1236,12/11/2018,TramsRail_FR_Dif,0.679682088,2018-12-11
1237,1237,12/11/2018,FirstBus_UK_Dif,0.362196311,2018-12-11
1238,1238,12/11/2018,Uestra_DE_Dif,0.66232543,2018-12-11
1239,1239,12/11/2018,FirstGroup_USA_Dif,0.482043017,2018-12-11
1240,1240,13/11/2018,ChinaRail_Dif,2.028523472,2018-11-13
1241,1241,13/11/2018,HongKongPT_Dif,0.408744815,2018-11-13
1242,1242,13/11/2018,JapanRail_Dif,1.671597722,2018-11-13
1243,1243,13/11/2018,SaudiPT_Dif,0.016576646,2018-11-13
1244,1244,13/11/2018,TramsRail_FR_Dif,0.618244481,2018-11-13
1245,1245,13/11/2018,FirstBus_UK_Dif,0.335839439,2018-11-13
1246,1246,13/11/2018,Uestra_DE_Dif,0.56414101,2018-11-13
1247,1247,13/11/2018,FirstGroup_USA_Dif,0.831677193,2018-11-13
1248,1248,14/11/2018,ChinaRail_Dif,2.181838562,2018-11-14
1249,1249,14/11/2018,HongKongPT_Dif,0.568621962,2018-11-14
1250,1250,14/11/2018,JapanRail_Dif,1.668320798,2018-11-14
1251,1251,14/11/2018,SaudiPT_Dif,-0.011256985,2018-11-14
1252,1252,14/11/2018,TramsRail_FR_Dif,0.66565863,2018-11-14
1253,1253,14/11/2018,FirstBus_UK_Dif,0.185342286,2018-11-14
1254,1254,14/11/2018,Uestra_DE_Dif,0.604068809,2018-11-14
1255,1255,14/11/2018,FirstGroup_USA_Dif,0.798218527,2018-11-14
1256,1256,15/11/2018,ChinaRail_Dif,2.255855572,2018-11-15
1257,1257,15/11/2018,HongKongPT_Dif,0.442436384,2018-11-15
1258,1258,15/11/2018,JapanRail_Dif,1.756399576,2018-11-15
1259,1259,15/11/2018,SaudiPT_Dif,-0.018987094,2018-11-15
1260,1260,15/11/2018,TramsRail_FR_Dif,0.716276798,2018-11-15
1261,1261,15/11/2018,FirstBus_UK_Dif,0.340317704,2018-11-15
1262,1262,15/11/2018,Uestra_DE_Dif,0.643442001,2018-11-15
1263,1263,15/11/2018,FirstGroup_USA_Dif,0.558907764,2018-11-15
1264,1264,19/11/2018,ChinaRail_Dif,2.189870158,2018-11-19
1265,1265,19/11/2018,HongKongPT_Dif,0.245955087,2018-11-19
1266,1266,19/11/2018,JapanRail_Dif,1.77317654,2018-11-19
1267,1267,19/11/2018,SaudiPT_Dif,0.045433799,2018-11-19
1268,1268,19/11/2018,TramsRail_FR_Dif,0.785486975,2018-11-19
1269,1269,19/11/2018,FirstBus_UK_Dif,0.454739985,2018-11-19
1270,1270,19/11/2018,Uestra_DE_Dif,0.716441767,2018-11-19
1271,1271,19/11/2018,FirstGroup_USA_Dif,0.648797889,2018-11-19
1272,1272,20/11/2018,ChinaRail_Dif,2.282115844,2018-11-20
1273,1273,20/11/2018,HongKongPT_Dif,0.395401125,2018-11-20
1274,1274,20/11/2018,JapanRail_Dif,2.063627693,2018-11-20
1275,1275,20/11/2018,SaudiPT_Dif,0.081301839,2018-11-20
1276,1276,20/11/2018,TramsRail_FR_Dif,0.872499207,2018-11-20
1277,1277,20/11/2018,FirstBus_UK_Dif,0.448582599,2018-11-20
1278,1278,20/11/2018,Uestra_DE_Dif,0.835597394,2018-11-20
1279,1279,20/11/2018,FirstGroup_USA_Dif,0.719536816,2018-11-20
1280,1280,21/11/2018,ChinaRail_Dif,2.17852184,2018-11-21
1281,1281,21/11/2018,HongKongPT_Dif,0.358541136,2018-11-21
1282,1282,21/11/2018,JapanRail_Dif,2.002980008,2018-11-21
1283,1283,21/11/2018,SaudiPT_Dif,0.138048366,2018-11-21
1284,1284,21/11/2018,TramsRail_FR_Dif,0.79978334,2018-11-21
1285,1285,21/11/2018,FirstBus_UK_Dif,0.322526974,2018-11-21
1286,1286,21/11/2018,Uestra_DE_Dif,0.997204582,2018-11-21
1287,1287,21/11/2018,FirstGroup_USA_Dif,0.864867519,2018-11-21
1288,1288,26/11/2018,ChinaRail_Dif,1.72155771,2018-11-26
1289,1289,26/11/2018,HongKongPT_Dif,0.244780205,2018-11-26
1290,1290,26/11/2018,JapanRail_Dif,2.076431275,2018-11-26
1291,1291,26/11/2018,SaudiPT_Dif,0.180054223,2018-11-26
1292,1292,26/11/2018,TramsRail_FR_Dif,0.771794652,2018-11-26
1293,1293,26/11/2018,FirstBus_UK_Dif,0.401668285,2018-11-26
1294,1294,26/11/2018,Uestra_DE_Dif,0.591736786,2018-11-26
1295,1295,26/11/2018,FirstGroup_USA_Dif,0.995400196,2018-11-26
1296,1296,27/11/2018,ChinaRail_Dif,1.810254435,2018-11-27
1297,1297,27/11/2018,HongKongPT_Dif,0.257209794,2018-11-27
1298,1298,27/11/2018,JapanRail_Dif,2.042147302,2018-11-27
1299,1299,27/11/2018,SaudiPT_Dif,0.215257382,2018-11-27
1300,1300,27/11/2018,TramsRail_FR_Dif,0.788792019,2018-11-27
1301,1301,27/11/2018,FirstBus_UK_Dif,0.399791367,2018-11-27
1302,1302,27/11/2018,Uestra_DE_Dif,0.622246062,2018-11-27
1303,1303,27/11/2018,FirstGroup_USA_Dif,1.030009586,2018-11-27
1304,1304,28/11/2018,ChinaRail_Dif,1.787970958,2018-11-28
1305,1305,28/11/2018,HongKongPT_Dif,0.219140492,2018-11-28
1306,1306,28/11/2018,JapanRail_Dif,1.967274542,2018-11-28
1307,1307,28/11/2018,SaudiPT_Dif,0.122179081,2018-11-28
1308,1308,28/11/2018,TramsRail_FR_Dif,0.78866223,2018-11-28
1309,1309,28/11/2018,FirstBus_UK_Dif,0.54069718,2018-11-28
1310,1310,28/11/2018,Uestra_DE_Dif,0.629089483,2018-11-28
1311,1311,28/11/2018,FirstGroup_USA_Dif,0.900888767,2018-11-28
1312,1312,29/11/2018,ChinaRail_Dif,1.776785133,2018-11-29
1313,1313,29/11/2018,HongKongPT_Dif,0.042295875,2018-11-29
1314,1314,29/11/2018,JapanRail_Dif,1.929438401,2018-11-29
1315,1315,29/11/2018,SaudiPT_Dif,0.13047823,2018-11-29
1316,1316,29/11/2018,TramsRail_FR_Dif,0.755601974,2018-11-29
1317,1317,29/11/2018,FirstBus_UK_Dif,0.468707372,2018-11-29
1318,1318,29/11/2018,Uestra_DE_Dif,0.629523893,2018-11-29
1319,1319,29/11/2018,FirstGroup_USA_Dif,0.876699215,2018-11-29
1320,1320,03/12/2018,ChinaRail_Dif,1.485502481,2018-03-12
1321,1321,03/12/2018,HongKongPT_Dif,-0.042223214,2018-03-12
1322,1322,03/12/2018,JapanRail_Dif,2.043401481,2018-03-12
1323,1323,03/12/2018,SaudiPT_Dif,0.08879178,2018-03-12
1324,1324,03/12/2018,TramsRail_FR_Dif,0.687023901,2018-03-12
1325,1325,03/12/2018,FirstBus_UK_Dif,0.477580244,2018-03-12
1326,1326,03/12/2018,Uestra_DE_Dif,0.237144331,2018-03-12
1327,1327,03/12/2018,FirstGroup_USA_Dif,0.887337113,2018-03-12
1328,1328,04/12/2018,ChinaRail_Dif,1.596932698,2018-04-12
1329,1329,04/12/2018,HongKongPT_Dif,-0.003779175,2018-04-12
1330,1330,04/12/2018,JapanRail_Dif,1.914319177,2018-04-12
1331,1331,04/12/2018,SaudiPT_Dif,0.131101667,2018-04-12
1332,1332,04/12/2018,TramsRail_FR_Dif,0.74639191,2018-04-12
1333,1333,04/12/2018,FirstBus_UK_Dif,0.118226816,2018-04-12
1334,1334,04/12/2018,Uestra_DE_Dif,0.201791726,2018-04-12
1335,1335,04/12/2018,FirstGroup_USA_Dif,0.966080187,2018-04-12
1336,1336,06/12/2018,ChinaRail_Dif,1.573605949,2018-06-12
1337,1337,06/12/2018,HongKongPT_Dif,0.125119538,2018-06-12
1338,1338,06/12/2018,JapanRail_Dif,2.133568157,2018-06-12
1339,1339,06/12/2018,SaudiPT_Dif,0.077860633,2018-06-12
1340,1340,06/12/2018,TramsRail_FR_Dif,1.080015385,2018-06-12
1341,1341,06/12/2018,FirstBus_UK_Dif,0.663730219,2018-06-12
1342,1342,06/12/2018,Uestra_DE_Dif,0.674942376,2018-06-12
1343,1343,06/12/2018,FirstGroup_USA_Dif,0.819031203,2018-06-12
1344,1344,10/12/2018,ChinaRail_Dif,1.753902147,2018-10-12
1345,1345,10/12/2018,HongKongPT_Dif,0.238681178,2018-10-12
1346,1346,10/12/2018,JapanRail_Dif,2.326518918,2018-10-12
1347,1347,10/12/2018,SaudiPT_Dif,0.133006054,2018-10-12
1348,1348,10/12/2018,TramsRail_FR_Dif,1.134728552,2018-10-12
1349,1349,10/12/2018,FirstBus_UK_Dif,0.568587659,2018-10-12
1350,1350,10/12/2018,Uestra_DE_Dif,0.495292357,2018-10-12
1351,1351,10/12/2018,FirstGroup_USA_Dif,0.64295555,2018-10-12
1352,1352,11/12/2018,ChinaRail_Dif,1.662678782,2018-11-12
1353,1353,11/12/2018,HongKongPT_Dif,0.233259155,2018-11-12
1354,1354,11/12/2018,JapanRail_Dif,2.24234011,2018-11-12
1355,1355,11/12/2018,SaudiPT_Dif,0.094713669,2018-11-12
1356,1356,11/12/2018,TramsRail_FR_Dif,1.043032012,2018-11-12
1357,1357,11/12/2018,FirstBus_UK_Dif,0.31379899,2018-11-12
1358,1358,11/12/2018,Uestra_DE_Dif,0.389308161,2018-11-12
1359,1359,11/12/2018,FirstGroup_USA_Dif,0.60088794,2018-11-12
1360,1360,12/12/2018,ChinaRail_Dif,1.851083218,2018-12-12
1361,1361,12/12/2018,HongKongPT_Dif,0.11659396,2018-12-12
1362,1362,12/12/2018,JapanRail_Dif,2.170347933,2018-12-12
1363,1363,12/12/2018,SaudiPT_Dif,0.074667234,2018-12-12
1364,1364,12/12/2018,TramsRail_FR_Dif,0.894683197,2018-12-12
1365,1365,12/12/2018,FirstBus_UK_Dif,0.254465225,2018-12-12
1366,1366,12/12/2018,Uestra_DE_Dif,0.289691822,2018-12-12
1367,1367,12/12/2018,FirstGroup_USA_Dif,0.75553032,2018-12-12
1368,1368,13/12/2018,ChinaRail_Dif,1.984977787,2018-12-13
1369,1369,13/12/2018,HongKongPT_Dif,0.082167417,2018-12-13
1370,1370,13/12/2018,JapanRail_Dif,2.108500821,2018-12-13
1371,1371,13/12/2018,SaudiPT_Dif,0.019985336,2018-12-13
1372,1372,13/12/2018,TramsRail_FR_Dif,0.912686599,2018-12-13
1373,1373,13/12/2018,FirstBus_UK_Dif,0.111718736,2018-12-13
1374,1374,13/12/2018,Uestra_DE_Dif,0.2928555,2018-12-13
1375,1375,13/12/2018,FirstGroup_USA_Dif,0.74390071,2018-12-13
1376,1376,17/12/2018,ChinaRail_Dif,1.974169599,2018-12-17
1377,1377,17/12/2018,HongKongPT_Dif,0.204827802,2018-12-17
1378,1378,17/12/2018,JapanRail_Dif,2.379871838,2018-12-17
1379,1379,17/12/2018,SaudiPT_Dif,0.020603566,2018-12-17
1380,1380,17/12/2018,TramsRail_FR_Dif,1.05212702,2018-12-17
1381,1381,17/12/2018,FirstBus_UK_Dif,0.123776686,2018-12-17
1382,1382,17/12/2018,Uestra_DE_Dif,0.394866645,2018-12-17
1383,1383,17/12/2018,FirstGroup_USA_Dif,0.752869247,2018-12-17
1384,1384,18/12/2018,ChinaRail_Dif,1.993913553,2018-12-18
1385,1385,18/12/2018,HongKongPT_Dif,0.281771567,2018-12-18
1386,1386,18/12/2018,JapanRail_Dif,2.325616644,2018-12-18
1387,1387,18/12/2018,SaudiPT_Dif,-0.003098561,2018-12-18
1388,1388,18/12/2018,TramsRail_FR_Dif,1.1179178,2018-12-18
1389,1389,18/12/2018,FirstBus_UK_Dif,0.179932482,2018-12-18
1390,1390,18/12/2018,Uestra_DE_Dif,0.415811069,2018-12-18
1391,1391,18/12/2018,FirstGroup_USA_Dif,0.802220372,2018-12-18
1392,1392,19/12/2018,ChinaRail_Dif,1.922337379,2018-12-19
1393,1393,19/12/2018,HongKongPT_Dif,0.267396286,2018-12-19
1394,1394,19/12/2018,JapanRail_Dif,2.355883478,2018-12-19
1395,1395,19/12/2018,SaudiPT_Dif,0.041965845,2018-12-19
1396,1396,19/12/2018,TramsRail_FR_Dif,1.084339793,2018-12-19
1397,1397,19/12/2018,FirstBus_UK_Dif,-0.168188797,2018-12-19
1398,1398,19/12/2018,Uestra_DE_Dif,0.398873665,2018-12-19
1399,1399,19/12/2018,FirstGroup_USA_Dif,0.833748852,2018-12-19
1400,1400,20/12/2018,ChinaRail_Dif,1.818721346,2018-12-20
1401,1401,20/12/2018,HongKongPT_Dif,0.335381854,2018-12-20
1402,1402,20/12/2018,JapanRail_Dif,2.511492122,2018-12-20
1403,1403,20/12/2018,SaudiPT_Dif,0.087932308,2018-12-20
1404,1404,20/12/2018,TramsRail_FR_Dif,1.206453116,2018-12-20
1405,1405,20/12/2018,FirstBus_UK_Dif,-0.069774517,2018-12-20
1406,1406,20/12/2018,Uestra_DE_Dif,0.502630941,2018-12-20
1407,1407,20/12/2018,FirstGroup_USA_Dif,0.961002721,2018-12-20
1408,1408,27/12/2018,ChinaRail_Dif,1.821247465,2018-12-27
1409,1409,27/12/2018,HongKongPT_Dif,0.255078779,2018-12-27
1410,1410,27/12/2018,JapanRail_Dif,2.728997277,2018-12-27
1411,1411,27/12/2018,SaudiPT_Dif,0.026048424,2018-12-27
1412,1412,27/12/2018,TramsRail_FR_Dif,1.341296222,2018-12-27
1413,1413,27/12/2018,FirstBus_UK_Dif,0.245596988,2018-12-27
1414,1414,27/12/2018,Uestra_DE_Dif,0.65620945,2018-12-27
1415,1415,27/12/2018,FirstGroup_USA_Dif,0.825587577,2018-12-27
1416,1416,07/01/2019,ChinaRail_Dif,1.835348967,2019-07-01
1417,1417,07/01/2019,HongKongPT_Dif,0.63863157,2019-07-01
1418,1418,07/01/2019,JapanRail_Dif,2.833246196,2019-07-01
1419,1419,07/01/2019,SaudiPT_Dif,-0.15919808,2019-07-01
1420,1420,07/01/2019,TramsRail_FR_Dif,1.168076447,2019-07-01
1421,1421,07/01/2019,FirstBus_UK_Dif,0.206123352,2019-07-01
1422,1422,07/01/2019,Uestra_DE_Dif,0.717199003,2019-07-01
1423,1423,07/01/2019,FirstGroup_USA_Dif,1.090890252,2019-07-01
1424,1424,08/01/2019,ChinaRail_Dif,1.900443192,2019-08-01
1425,1425,08/01/2019,HongKongPT_Dif,0.325050265,2019-08-01
1426,1426,08/01/2019,JapanRail_Dif,2.665701506,2019-08-01
1427,1427,08/01/2019,SaudiPT_Dif,-0.162312189,2019-08-01
1428,1428,08/01/2019,TramsRail_FR_Dif,1.090345838,2019-08-01
1429,1429,08/01/2019,FirstBus_UK_Dif,0.133917188,2019-08-01
1430,1430,08/01/2019,Uestra_DE_Dif,0.679624855,2019-08-01
1431,1431,08/01/2019,FirstGroup_USA_Dif,1.114066735,2019-08-01
1432,1432,09/01/2019,ChinaRail_Dif,1.840345321,2019-09-01
1433,1433,09/01/2019,HongKongPT_Dif,0.099603429,2019-09-01
1434,1434,09/01/2019,JapanRail_Dif,2.688279237,2019-09-01
1435,1435,09/01/2019,SaudiPT_Dif,-0.185046669,2019-09-01
1436,1436,09/01/2019,TramsRail_FR_Dif,1.032428652,2019-09-01
1437,1437,09/01/2019,FirstBus_UK_Dif,0.007234304,2019-09-01
1438,1438,09/01/2019,Uestra_DE_Dif,0.619863152,2019-09-01
1439,1439,09/01/2019,FirstGroup_USA_Dif,1.172857275,2019-09-01
1440,1440,10/01/2019,ChinaRail_Dif,1.833263742,2019-10-01
1441,1441,10/01/2019,HongKongPT_Dif,0.143469568,2019-10-01
1442,1442,10/01/2019,JapanRail_Dif,2.876934242,2019-10-01
1443,1443,10/01/2019,SaudiPT_Dif,-0.211115411,2019-10-01
1444,1444,10/01/2019,TramsRail_FR_Dif,1.043807936,2019-10-01
1445,1445,10/01/2019,FirstBus_UK_Dif,-0.085652747,2019-10-01
1446,1446,10/01/2019,Uestra_DE_Dif,0.600952941,2019-10-01
1447,1447,10/01/2019,FirstGroup_USA_Dif,1.172004954,2019-10-01
1448,1448,15/01/2019,ChinaRail_Dif,1.851312524,2019-01-15
1449,1449,15/01/2019,HongKongPT_Dif,0.117133162,2019-01-15
1450,1450,15/01/2019,JapanRail_Dif,2.656205732,2019-01-15
1451,1451,15/01/2019,SaudiPT_Dif,-0.210546175,2019-01-15
1452,1452,15/01/2019,TramsRail_FR_Dif,1.071811356,2019-01-15
1453,1453,15/01/2019,FirstBus_UK_Dif,0.074002544,2019-01-15
1454,1454,15/01/2019,Uestra_DE_Dif,0.95240525,2019-01-15
1455,1455,15/01/2019,FirstGroup_USA_Dif,1.126801575,2019-01-15
1456,1456,16/01/2019,ChinaRail_Dif,1.783459839,2019-01-16
1457,1457,16/01/2019,HongKongPT_Dif,-0.084496908,2019-01-16
1458,1458,16/01/2019,JapanRail_Dif,2.640469608,2019-01-16
1459,1459,16/01/2019,SaudiPT_Dif,-0.239010506,2019-01-16
1460,1460,16/01/2019,TramsRail_FR_Dif,1.036508918,2019-01-16
1461,1461,16/01/2019,FirstBus_UK_Dif,0.277150881,2019-01-16
1462,1462,16/01/2019,Uestra_DE_Dif,0.926016007,2019-01-16
1463,1463,16/01/2019,FirstGroup_USA_Dif,1.101595235,2019-01-16
1464,1464,17/01/2019,ChinaRail_Dif,1.719764161,2019-01-17
1465,1465,17/01/2019,HongKongPT_Dif,-0.043325543,2019-01-17
1466,1466,17/01/2019,JapanRail_Dif,2.651515345,2019-01-17
1467,1467,17/01/2019,SaudiPT_Dif,-0.252589154,2019-01-17
1468,1468,17/01/2019,TramsRail_FR_Dif,1.060029378,2019-01-17
1469,1469,17/01/2019,FirstBus_UK_Dif,0.396739848,2019-01-17
1470,1470,17/01/2019,Uestra_DE_Dif,0.934457925,2019-01-17
1471,1471,17/01/2019,FirstGroup_USA_Dif,1.071988712,2019-01-17
1472,1472,22/01/2019,ChinaRail_Dif,1.53514068,2019-01-22
1473,1473,22/01/2019,HongKongPT_Dif,-0.294991448,2019-01-22
1474,1474,22/01/2019,JapanRail_Dif,2.631922012,2019-01-22
1475,1475,22/01/2019,SaudiPT_Dif,-0.168930145,2019-01-22
1476,1476,22/01/2019,TramsRail_FR_Dif,0.983649972,2019-01-22
1477,1477,22/01/2019,FirstBus_UK_Dif,0.19230171,2019-01-22
1478,1478,22/01/2019,Uestra_DE_Dif,0.233211397,2019-01-22
1479,1479,22/01/2019,FirstGroup_USA_Dif,1.099319911,2019-01-22
1480,1480,23/01/2019,ChinaRail_Dif,1.524834011,2019-01-23
1481,1481,23/01/2019,HongKongPT_Dif,-0.114320784,2019-01-23
1482,1482,23/01/2019,JapanRail_Dif,2.63785404,2019-01-23
1483,1483,23/01/2019,SaudiPT_Dif,-0.204154294,2019-01-23
1484,1484,23/01/2019,TramsRail_FR_Dif,0.993922897,2019-01-23
1485,1485,23/01/2019,FirstBus_UK_Dif,0.286600097,2019-01-23
1486,1486,23/01/2019,Uestra_DE_Dif,0.245633554,2019-01-23
1487,1487,23/01/2019,FirstGroup_USA_Dif,1.084463803,2019-01-23
1488,1488,24/01/2019,ChinaRail_Dif,1.407331714,2019-01-24
1489,1489,24/01/2019,HongKongPT_Dif,-0.146022823,2019-01-24
1490,1490,24/01/2019,JapanRail_Dif,2.592951259,2019-01-24
1491,1491,24/01/2019,SaudiPT_Dif,-0.229946336,2019-01-24
1492,1492,24/01/2019,TramsRail_FR_Dif,0.948548881,2019-01-24
1493,1493,24/01/2019,FirstBus_UK_Dif,0.29338702,2019-01-24
1494,1494,24/01/2019,Uestra_DE_Dif,0.206407995,2019-01-24
1495,1495,24/01/2019,FirstGroup_USA_Dif,1.110101197,2019-01-24
1496,1496,28/01/2019,ChinaRail_Dif,1.32682595,2019-01-28
1497,1497,28/01/2019,HongKongPT_Dif,-0.274195818,2019-01-28
1498,1498,28/01/2019,JapanRail_Dif,2.490270197,2019-01-28
1499,1499,28/01/2019,SaudiPT_Dif,-0.183595406,2019-01-28
1500,1500,28/01/2019,TramsRail_FR_Dif,0.924669223,2019-01-28
1501,1501,28/01/2019,FirstBus_UK_Dif,0.435334059,2019-01-28
1502,1502,28/01/2019,Uestra_DE_Dif,0.15280707,2019-01-28
1503,1503,28/01/2019,FirstGroup_USA_Dif,1.037456647,2019-01-28
1504,1504,29/01/2019,ChinaRail_Dif,1.530222584,2019-01-29
1505,1505,29/01/2019,HongKongPT_Dif,-0.261467568,2019-01-29
1506,1506,29/01/2019,JapanRail_Dif,2.583931523,2019-01-29
1507,1507,29/01/2019,SaudiPT_Dif,-0.213901332,2019-01-29
1508,1508,29/01/2019,TramsRail_FR_Dif,0.867772104,2019-01-29
1509,1509,29/01/2019,FirstBus_UK_Dif,0.252915911,2019-01-29
1510,1510,29/01/2019,Uestra_DE_Dif,0.402121357,2019-01-29
1511,1511,29/01/2019,FirstGroup_USA_Dif,0.997657562,2019-01-29
1512,1512,30/01/2019,ChinaRail_Dif,1.498973478,2019-01-30
1513,1513,30/01/2019,HongKongPT_Dif,-0.292716673,2019-01-30
1514,1514,30/01/2019,JapanRail_Dif,2.639922231,2019-01-30
1515,1515,30/01/2019,SaudiPT_Dif,-0.268968156,2019-01-30
1516,1516,30/01/2019,TramsRail_FR_Dif,0.800846903,2019-01-30
1517,1517,30/01/2019,FirstBus_UK_Dif,-0.046844262,2019-01-30
1518,1518,30/01/2019,Uestra_DE_Dif,-0.083042727,2019-01-30
1519,1519,30/01/2019,FirstGroup_USA_Dif,1.021329473,2019-01-30
1520,1520,31/01/2019,ChinaRail_Dif,1.386151589,2019-01-31
1521,1521,31/01/2019,HongKongPT_Dif,-0.376938116,2019-01-31
1522,1522,31/01/2019,JapanRail_Dif,2.610354911,2019-01-31
1523,1523,31/01/2019,SaudiPT_Dif,-0.271896902,2019-01-31
1524,1524,31/01/2019,TramsRail_FR_Dif,0.775041466,2019-01-31
1525,1525,31/01/2019,FirstBus_UK_Dif,-0.256952445,2019-01-31
1526,1526,31/01/2019,Uestra_DE_Dif,0.432711636,2019-01-31
1527,1527,31/01/2019,FirstGroup_USA_Dif,1.046995428,2019-01-31
1528,1528,04/02/2019,ChinaRail_Dif,1.429933029,2019-04-02
1529,1529,04/02/2019,HongKongPT_Dif,-0.087950191,2019-04-02
1530,1530,04/02/2019,JapanRail_Dif,2.731698054,2019-04-02
1531,1531,04/02/2019,SaudiPT_Dif,-0.341167619,2019-04-02
1532,1532,04/02/2019,TramsRail_FR_Dif,0.76430902,2019-04-02
1533,1533,04/02/2019,FirstBus_UK_Dif,-0.186885964,2019-04-02
1534,1534,04/02/2019,Uestra_DE_Dif,1.195425328,2019-04-02
1535,1535,04/02/2019,FirstGroup_USA_Dif,1.142299229,2019-04-02
1536,1536,12/02/2019,ChinaRail_Dif,1.35995435,2019-12-02
1537,1537,12/02/2019,HongKongPT_Dif,-0.441268923,2019-12-02
1538,1538,12/02/2019,JapanRail_Dif,2.742570282,2019-12-02
1539,1539,12/02/2019,SaudiPT_Dif,-0.286875862,2019-12-02
1540,1540,12/02/2019,TramsRail_FR_Dif,0.683618535,2019-12-02
1541,1541,12/02/2019,FirstBus_UK_Dif,-0.116854259,2019-12-02
1542,1542,12/02/2019,Uestra_DE_Dif,-0.045863794,2019-12-02
1543,1543,12/02/2019,FirstGroup_USA_Dif,0.974005784,2019-12-02
1544,1544,13/02/2019,ChinaRail_Dif,1.36357888,2019-02-13
1545,1545,13/02/2019,HongKongPT_Dif,-0.472496933,2019-02-13
1546,1546,13/02/2019,JapanRail_Dif,2.593109658,2019-02-13
1547,1547,13/02/2019,SaudiPT_Dif,-0.354930554,2019-02-13
1548,1548,13/02/2019,TramsRail_FR_Dif,0.657871327,2019-02-13
1549,1549,13/02/2019,FirstBus_UK_Dif,-0.209536175,2019-02-13
1550,1550,13/02/2019,Uestra_DE_Dif,0.43664484,2019-02-13
1551,1551,13/02/2019,FirstGroup_USA_Dif,1.000961125,2019-02-13
1552,1552,14/02/2019,ChinaRail_Dif,1.496402709,2019-02-14
1553,1553,14/02/2019,HongKongPT_Dif,-0.454074351,2019-02-14
1554,1554,14/02/2019,JapanRail_Dif,2.580293968,2019-02-14
1555,1555,14/02/2019,SaudiPT_Dif,-0.367918746,2019-02-14
1556,1556,14/02/2019,TramsRail_FR_Dif,0.674753638,2019-02-14
1557,1557,14/02/2019,FirstBus_UK_Dif,-0.29435322,2019-02-14
1558,1558,14/02/2019,Uestra_DE_Dif,-0.02158846,2019-02-14
1559,1559,14/02/2019,FirstGroup_USA_Dif,1.047032945,2019-02-14
1560,1560,19/02/2019,ChinaRail_Dif,1.601390438,2019-02-19
1561,1561,19/02/2019,HongKongPT_Dif,-0.396753853,2019-02-19
1562,1562,19/02/2019,JapanRail_Dif,2.756722384,2019-02-19
1563,1563,19/02/2019,SaudiPT_Dif,-0.215706735,2019-02-19
1564,1564,19/02/2019,TramsRail_FR_Dif,0.533947983,2019-02-19
1565,1565,19/02/2019,FirstBus_UK_Dif,0.006585374,2019-02-19
1566,1566,19/02/2019,Uestra_DE_Dif,-0.168364049,2019-02-19
1567,1567,19/02/2019,FirstGroup_USA_Dif,1.056330578,2019-02-19
1568,1568,20/02/2019,ChinaRail_Dif,1.616354222,2019-02-20
1569,1569,20/02/2019,HongKongPT_Dif,-0.47712399,2019-02-20
1570,1570,20/02/2019,JapanRail_Dif,2.832538617,2019-02-20
1571,1571,20/02/2019,SaudiPT_Dif,-0.190633482,2019-02-20
1572,1572,20/02/2019,TramsRail_FR_Dif,0.483042176,2019-02-20
1573,1573,20/02/2019,FirstBus_UK_Dif,0.005171445,2019-02-20
1574,1574,20/02/2019,Uestra_DE_Dif,-0.230413425,2019-02-20
1575,1575,20/02/2019,FirstGroup_USA_Dif,0.972378144,2019-02-20
1576,1576,21/02/2019,ChinaRail_Dif,1.564717414,2019-02-21
1577,1577,21/02/2019,HongKongPT_Dif,-0.509694014,2019-02-21
1578,1578,21/02/2019,JapanRail_Dif,2.839802019,2019-02-21
1579,1579,21/02/2019,SaudiPT_Dif,-0.195275969,2019-02-21
1580,1580,21/02/2019,TramsRail_FR_Dif,0.482812766,2019-02-21
1581,1581,21/02/2019,FirstBus_UK_Dif,0.041263773,2019-02-21
1582,1582,21/02/2019,Uestra_DE_Dif,-0.244668594,2019-02-21
1583,1583,21/02/2019,FirstGroup_USA_Dif,0.972528009,2019-02-21
1584,1584,25/02/2019,ChinaRail_Dif,1.500731151,2019-02-25
1585,1585,25/02/2019,HongKongPT_Dif,-0.602280724,2019-02-25
1586,1586,25/02/2019,JapanRail_Dif,2.819827265,2019-02-25
1587,1587,25/02/2019,SaudiPT_Dif,-0.169427649,2019-02-25
1588,1588,25/02/2019,TramsRail_FR_Dif,0.431461469,2019-02-25
1589,1589,25/02/2019,FirstBus_UK_Dif,-0.064954268,2019-02-25
1590,1590,25/02/2019,Uestra_DE_Dif,-0.299593651,2019-02-25
1591,1591,25/02/2019,FirstGroup_USA_Dif,0.920179092,2019-02-25
1592,1592,26/02/2019,ChinaRail_Dif,1.753564607,2019-02-26
1593,1593,26/02/2019,HongKongPT_Dif,-0.428685538,2019-02-26
1594,1594,26/02/2019,JapanRail_Dif,2.880991435,2019-02-26
1595,1595,26/02/2019,SaudiPT_Dif,-0.133392085,2019-02-26
1596,1596,26/02/2019,TramsRail_FR_Dif,0.421590537,2019-02-26
1597,1597,26/02/2019,FirstBus_UK_Dif,-0.084837245,2019-02-26
1598,1598,26/02/2019,Uestra_DE_Dif,-0.323273877,2019-02-26
1599,1599,26/02/2019,FirstGroup_USA_Dif,0.873795596,2019-02-26
1600,1600,27/02/2019,ChinaRail_Dif,1.576539776,2019-02-27
1601,1601,27/02/2019,HongKongPT_Dif,-0.182649651,2019-02-27
1602,1602,27/02/2019,JapanRail_Dif,2.882523858,2019-02-27
1603,1603,27/02/2019,SaudiPT_Dif,-0.156033614,2019-02-27
1604,1604,27/02/2019,TramsRail_FR_Dif,0.44080062,2019-02-27
1605,1605,27/02/2019,FirstBus_UK_Dif,0.027507348,2019-02-27
1606,1606,27/02/2019,Uestra_DE_Dif,-0.287513144,2019-02-27
1607,1607,27/02/2019,FirstGroup_USA_Dif,0.8284524,2019-02-27
1608,1608,28/02/2019,ChinaRail_Dif,1.630535673,2019-02-28
1609,1609,28/02/2019,HongKongPT_Dif,-0.14772108,2019-02-28
1610,1610,28/02/2019,JapanRail_Dif,2.891499795,2019-02-28
1611,1611,28/02/2019,SaudiPT_Dif,-0.159645228,2019-02-28
1612,1612,28/02/2019,TramsRail_FR_Dif,0.41899056,2019-02-28
1613,1613,28/02/2019,FirstBus_UK_Dif,0.095820708,2019-02-28
1614,1614,28/02/2019,Uestra_DE_Dif,0.203577856,2019-02-28
1615,1615,28/02/2019,FirstGroup_USA_Dif,0.796745581,2019-02-28
1616,1616,04/03/2019,ChinaRail_Dif,1.586450156,2019-04-03
1617,1617,04/03/2019,HongKongPT_Dif,-0.178991837,2019-04-03
1618,1618,04/03/2019,JapanRail_Dif,2.726539536,2019-04-03
1619,1619,04/03/2019,SaudiPT_Dif,-0.125286945,2019-04-03
1620,1620,04/03/2019,TramsRail_FR_Dif,0.352840582,2019-04-03
1621,1621,04/03/2019,FirstBus_UK_Dif,0.029704956,2019-04-03
1622,1622,04/03/2019,Uestra_DE_Dif,0.152056872,2019-04-03
1623,1623,04/03/2019,FirstGroup_USA_Dif,0.871279954,2019-04-03
1624,1624,05/03/2019,ChinaRail_Dif,1.60495255,2019-05-03
1625,1625,05/03/2019,HongKongPT_Dif,-0.179556768,2019-05-03
1626,1626,05/03/2019,JapanRail_Dif,2.726227753,2019-05-03
1627,1627,05/03/2019,SaudiPT_Dif,-0.135659396,2019-05-03
1628,1628,05/03/2019,TramsRail_FR_Dif,0.337107425,2019-05-03
1629,1629,05/03/2019,FirstBus_UK_Dif,-0.077020141,2019-05-03
1630,1630,05/03/2019,Uestra_DE_Dif,0.133273391,2019-05-03
1631,1631,05/03/2019,FirstGroup_USA_Dif,0.875991026,2019-05-03
1632,1632,06/03/2019,ChinaRail_Dif,1.678923391,2019-06-03
1633,1633,06/03/2019,HongKongPT_Dif,-0.261400757,2019-06-03
1634,1634,06/03/2019,JapanRail_Dif,2.757099901,2019-06-03
1635,1635,06/03/2019,SaudiPT_Dif,-0.102588175,2019-06-03
1636,1636,06/03/2019,TramsRail_FR_Dif,0.349621831,2019-06-03
1637,1637,06/03/2019,FirstBus_UK_Dif,-0.27985952,2019-06-03
1638,1638,06/03/2019,Uestra_DE_Dif,0.15542175,2019-06-03
1639,1639,06/03/2019,FirstGroup_USA_Dif,0.898983293,2019-06-03
1640,1640,07/03/2019,ChinaRail_Dif,1.665686902,2019-07-03
1641,1641,07/03/2019,HongKongPT_Dif,-0.188836446,2019-07-03
1642,1642,07/03/2019,JapanRail_Dif,2.86938724,2019-07-03
1643,1643,07/03/2019,SaudiPT_Dif,-0.126538353,2019-07-03
1644,1644,07/03/2019,TramsRail_FR_Dif,0.37963662,2019-07-03
1645,1645,07/03/2019,FirstBus_UK_Dif,-0.301528372,2019-07-03
1646,1646,07/03/2019,Uestra_DE_Dif,0.202132873,2019-07-03
1647,1647,07/03/2019,FirstGroup_USA_Dif,0.911856004,2019-07-03
1648,1648,11/03/2019,ChinaRail_Dif,1.323840006,2019-11-03
1649,1649,11/03/2019,HongKongPT_Dif,-0.111213006,2019-11-03
1650,1650,11/03/2019,JapanRail_Dif,2.998100872,2019-11-03
1651,1651,11/03/2019,SaudiPT_Dif,-0.187242616,2019-11-03
1652,1652,11/03/2019,TramsRail_FR_Dif,0.382452677,2019-11-03
1653,1653,11/03/2019,FirstBus_UK_Dif,-0.119757819,2019-11-03
1654,1654,11/03/2019,Uestra_DE_Dif,0.184954421,2019-11-03
1655,1655,11/03/2019,FirstGroup_USA_Dif,0.833708626,2019-11-03
1656,1656,12/03/2019,ChinaRail_Dif,1.444800549,2019-12-03
1657,1657,12/03/2019,HongKongPT_Dif,-0.22858862,2019-12-03
1658,1658,12/03/2019,JapanRail_Dif,2.948281116,2019-12-03
1659,1659,12/03/2019,SaudiPT_Dif,-0.174659784,2019-12-03
1660,1660,12/03/2019,TramsRail_FR_Dif,0.376288782,2019-12-03
1661,1661,12/03/2019,FirstBus_UK_Dif,-0.193610482,2019-12-03
1662,1662,12/03/2019,Uestra_DE_Dif,0.197871739,2019-12-03
1663,1663,12/03/2019,FirstGroup_USA_Dif,0.833874288,2019-12-03
1664,1664,13/03/2019,ChinaRail_Dif,1.343214083,2019-03-13
1665,1665,13/03/2019,HongKongPT_Dif,-0.31767029,2019-03-13
1666,1666,13/03/2019,JapanRail_Dif,2.92589399,2019-03-13
1667,1667,13/03/2019,SaudiPT_Dif,-0.297965432,2019-03-13
1668,1668,13/03/2019,TramsRail_FR_Dif,0.324377641,2019-03-13
1669,1669,13/03/2019,FirstBus_UK_Dif,-0.211086152,2019-03-13
1670,1670,13/03/2019,Uestra_DE_Dif,0.165602614,2019-03-13
1671,1671,13/03/2019,FirstGroup_USA_Dif,0.788393671,2019-03-13
1672,1672,14/03/2019,ChinaRail_Dif,1.349929238,2019-03-14
1673,1673,14/03/2019,HongKongPT_Dif,-0.330021919,2019-03-14
1674,1674,14/03/2019,JapanRail_Dif,2.974581215,2019-03-14
1675,1675,14/03/2019,SaudiPT_Dif,-0.339142006,2019-03-14
1676,1676,14/03/2019,TramsRail_FR_Dif,0.262020991,2019-03-14
1677,1677,14/03/2019,FirstBus_UK_Dif,-0.285301436,2019-03-14
1678,1678,14/03/2019,Uestra_DE_Dif,0.155528883,2019-03-14
1679,1679,14/03/2019,FirstGroup_USA_Dif,0.845849824,2019-03-14
1680,1680,18/03/2019,ChinaRail_Dif,1.355254244,2019-03-18
1681,1681,18/03/2019,HongKongPT_Dif,-0.48676485,2019-03-18
1682,1682,18/03/2019,JapanRail_Dif,2.961204678,2019-03-18
1683,1683,18/03/2019,SaudiPT_Dif,-0.363184328,2019-03-18
1684,1684,18/03/2019,TramsRail_FR_Dif,0.17143081,2019-03-18
1685,1685,18/03/2019,FirstBus_UK_Dif,-0.35403975,2019-03-18
1686,1686,18/03/2019,Uestra_DE_Dif,-0.095032688,2019-03-18
1687,1687,18/03/2019,FirstGroup_USA_Dif,0.848714746,2019-03-18
1688,1688,19/03/2019,ChinaRail_Dif,1.262889033,2019-03-19
1689,1689,19/03/2019,HongKongPT_Dif,-0.865751684,2019-03-19
1690,1690,19/03/2019,JapanRail_Dif,2.872939772,2019-03-19
1691,1691,19/03/2019,SaudiPT_Dif,-0.366297362,2019-03-19
1692,1692,19/03/2019,TramsRail_FR_Dif,0.152652186,2019-03-19
1693,1693,19/03/2019,FirstBus_UK_Dif,-0.592302861,2019-03-19
1694,1694,19/03/2019,Uestra_DE_Dif,-0.488913296,2019-03-19
1695,1695,19/03/2019,FirstGroup_USA_Dif,0.867895787,2019-03-19
1696,1696,20/03/2019,ChinaRail_Dif,1.074931792,2019-03-20
1697,1697,20/03/2019,HongKongPT_Dif,-0.462017671,2019-03-20
1698,1698,20/03/2019,JapanRail_Dif,2.936099995,2019-03-20
1699,1699,20/03/2019,SaudiPT_Dif,-0.346271687,2019-03-20
1700,1700,20/03/2019,TramsRail_FR_Dif,0.214778724,2019-03-20
1701,1701,20/03/2019,FirstBus_UK_Dif,-0.72759811,2019-03-20
1702,1702,20/03/2019,Uestra_DE_Dif,-0.365482817,2019-03-20
1703,1703,20/03/2019,FirstGroup_USA_Dif,0.843069666,2019-03-20
1704,1704,25/03/2019,ChinaRail_Dif,1.203804253,2019-03-25
1705,1705,25/03/2019,HongKongPT_Dif,-0.358774592,2019-03-25
1706,1706,25/03/2019,JapanRail_Dif,2.888525112,2019-03-25
1707,1707,25/03/2019,SaudiPT_Dif,-0.402739093,2019-03-25
1708,1708,25/03/2019,TramsRail_FR_Dif,0.195829058,2019-03-25
1709,1709,25/03/2019,FirstBus_UK_Dif,-0.912130649,2019-03-25
1710,1710,25/03/2019,Uestra_DE_Dif,-0.193408908,2019-03-25
1711,1711,25/03/2019,FirstGroup_USA_Dif,0.817467397,2019-03-25
1712,1712,26/03/2019,ChinaRail_Dif,1.134358245,2019-03-26
1713,1713,26/03/2019,HongKongPT_Dif,-0.67342607,2019-03-26
1714,1714,26/03/2019,JapanRail_Dif,3.098933724,2019-03-26
1715,1715,26/03/2019,SaudiPT_Dif,-0.40837605,2019-03-26
1716,1716,26/03/2019,TramsRail_FR_Dif,0.128673747,2019-03-26
1717,1717,26/03/2019,FirstBus_UK_Dif,-0.835967152,2019-03-26
1718,1718,26/03/2019,Uestra_DE_Dif,-0.242126807,2019-03-26
1719,1719,26/03/2019,FirstGroup_USA_Dif,0.820622363,2019-03-26
1720,1720,27/03/2019,ChinaRail_Dif,1.012739581,2019-03-27
1721,1721,27/03/2019,HongKongPT_Dif,-0.718777598,2019-03-27
1722,1722,27/03/2019,JapanRail_Dif,3.281808454,2019-03-27
1723,1723,27/03/2019,SaudiPT_Dif,-0.433505849,2019-03-27
1724,1724,27/03/2019,TramsRail_FR_Dif,0.137495147,2019-03-27
